,rating,tconst,title,year,cast1,cast2,cast3,cast4,director,genre1,genre2,plot,date,runtime,tagline,writers
737,7.5,tt0067128,Get Carter,1971,Michael Caine,Ian Hendry,Britt Ekland,John Osborne,Mike Hodges,Crime,Thriller,"When his brother dies under mysterious circumstances in a car accident, London gangster Jack Carter travels to Newcastle to investigate.",1971-03-18,112,The original gangster is back.,Mike Hodges
738,8.6,tt0120815,Saving Private Ryan,1998,Tom Hanks,Matt Damon,Tom Sizemore,Edward Burns,Steven Spielberg,Action,Drama,"Following the Normandy Landings, a group of U.S. soldiers go behind enemy lines to retrieve a paratrooper whose brothers have been killed in action.",1998-07-24,169,"In the Last Great Invasion of the Last Great War, The Greatest Danger for Eight Men was Saving... One.",Robert Rodat
739,7.6,tt0075005,The Omen,1976,Gregory Peck,Lee Remick,Harvey Stephens,David Warner,Richard Donner,Horror,Thriller,Mysterious deaths surround an American ambassador. Could the child that he is raising actually be the Antichrist? The Devil's own son?,1976-06-25,111,OUR FINAL WARNING.,David Seltzer
740,6.8,tt0081573,Superman II,1980,Gene Hackman,Christopher Reeve,Margot Kidder,Ned Beatty,Richard Lester,Action,Adventure,"Superman agrees to sacrifice his powers to start a relationship with Lois Lane, unaware that three Kryptonian criminals he inadvertently released are conquering Earth.",1981-06-19,116,"Miraculously freed from eternal orbit, the three outlaws from Krypton descend to earth, for the ultimate confrontation.",Joe Shuster
741,8.3,tt0086250,Scarface,1983,Al Pacino,Michelle Pfeiffer,Steven Bauer,Mary Elizabeth Mastrantonio,Brian De Palma,Crime,Drama,"In Miami in 1980, a determined Cuban immigrant takes over a drug cartel and succumbs to greed.",1983-12-09,170,He was Tony Montana. The world will remember him by another name...SCARFACE.,Oliver Stone
742,8.5,tt0209144,Memento,2000,Guy Pearce,Carrie-Anne Moss,Joe Pantoliano,Mark Boone Junior,Christopher Nolan,Mystery,Thriller,A man juggles searching for his wife's murderer and keeping his short-term memory loss from being an obstacle.,2001-05-25,113,Some memories are best forgotten,Christopher Nolan
743,7.8,tt0240772,Ocean's Eleven,2001,George Clooney,Brad Pitt,Julia Roberts,Matt Damon,Steven Soderbergh,Crime,Thriller,Danny Ocean and his eleven accomplices plan to rob three Las Vegas casinos simultaneously.,2001-12-07,116,"Hollywood's A list stars come together to pull off the most daring heist Las Vegas has ever known...11 men, 3 casinos, 150 million dollars, 1 chance to pull it off.",George Clayton Johnson
744,7.8,tt0109445,Clerks,1994,Brian O'Halloran,Jeff Anderson,Marilyn Ghigliotti,Lisa Spoonauer,Kevin Smith,Comedy,nan,"A day in the lives of two convenience clerks named Dante and Randal as they annoy customers, discuss movies, and play hockey on the store roof.",1994-11-09,102,Just Because They Serve You... Doesn't Mean They Like You.,Kevin Smith
745,7.2,tt0089885,Re-Animator,1985,Jeffrey Combs,Bruce Abbott,Barbara Crampton,David Gale,Stuart Gordon,Comedy,Horror,A dedicated student at a medical college and his girlfriend become involved in bizarre experiments centering around the re-animation of dead tissue when an odd new student arrives on campus.,1985-10-18,95,H.P. Lovecraft's classic tale of horror,H.P. Lovecraft
746,7.1,tt0313542,Runaway Jury,2003,John Cusack,Rachel Weisz,Gene Hackman,Dustin Hoffman,Gary Fleder,Drama,Thriller,A juror on the inside and a woman on the outside manipulate a court trial involving a major gun manufacturer.,2003-10-17,127,Trials are too important to be decided by juries.,John Grisham
747,7.0,tt1560970,Neds,2010,Conor McCarron,Greg Forrest,Joe Szula,Mhairi Anderson,Peter Mullan,Drama,nan,"Encompassed by violent street gangs, neglectful parents, bullying teachers and a dearth of positive role models, a studious but emotionally abandoned kid turns thug.",2011-04-20,124,Some people need to be taught a lesson.,Peter Mullan
748,6.4,tt0131325,Bowfinger,1999,Steve Martin,Eddie Murphy,Heather Graham,Christine Baranski,Frank Oz,Comedy,nan,"When a desperate movie producer fails to get a major star for his bargain basement film, he decides to shoot the film secretly around him.",1999-08-13,97,A desperate plan for a desperate man,Steve Martin
749,6.7,tt0356721,I Heart Huckabees,2004,Jason Schwartzman,Jude Law,Naomi Watts,Mark Wahlberg,David O. Russell,Comedy,nan,"A husband-and-wife team play detective, but not in the traditional sense. Instead, the happy duo helps others solve their existential issues, the kind that keep you up at night, wondering what it all means.",2004-10-22,107,An existential comedy,David O. Russell
750,7.2,tt0884328,The Mist,2007,Thomas Jane,Marcia Gay Harden,Laurie Holden,Andre Braugher,Frank Darabont,Horror,Sci-Fi,"A freak storm unleashes a species of bloodthirsty creatures on a small town, where a small band of citizens hole up in a supermarket and fight for their lives.",2007-11-21,126,Stephen King's Legendary Tale of Terror,Frank Darabont
751,6.3,tt0416315,Wolf Creek,2005,Nathan Phillips,Cassandra Magrath,Kestie Morassi,John Jarratt,Greg McLean,Horror,nan,Three backpackers stranded in the Australian outback are befriended by a local who turns out to be a sadistic psychopath and will plunge them into a hellish nightmare of insufferable torture.,2005-12-25,99,Based on true events.,Greg McLean
752,7.3,tt0119654,Men in Black,1997,Tommy Lee Jones,Will Smith,Linda Fiorentino,Vincent D'Onofrio,Barry Sonnenfeld,Adventure,Comedy,A police officer joins a secret organization that polices and monitors extraterrestrial interactions on Earth.,1997-07-02,98,Protecting the earth from the scum of the universe,Lowell Cunningham
753,7.6,tt0230600,The Others,2001,Nicole Kidman,Christopher Eccleston,Fionnula Flanagan,Alakina Mann,Alejandro Amenábar,Horror,Thriller,A woman who lives in a darkened old house with her two photosensitive children becomes convinced that her family home is haunted.,2001-08-10,104,"Sooner or later she'll see them, then everything will be different.",Alejandro Amenábar
754,7.0,tt1060277,Cloverfield,2008,Mike Vogel,Jessica Lucas,Lizzy Caplan,T.J. Miller,Matt Reeves,Action,Horror,A group of friends venture deep into the streets of New York on a rescue mission during a rampaging monster attack.,2008-01-18,85,Some Thing Has Found Us,Drew Goddard
755,8.5,tt0082971,Raiders of the Lost Ark,1981,Harrison Ford,Karen Allen,Paul Freeman,John Rhys-Davies,Steven Spielberg,Action,Adventure,Archaeologist and adventurer Indiana Jones is hired by the U.S. government to find the Ark of the Covenant before the Nazis.,1981-06-12,115,Indiana Jones - the new hero from the creators of JAWS and STAR WARS.,Lawrence Kasdan
756,8.2,tt0049902,A Man Escaped,1956,François Leterrier,Charles Le Clainche,Maurice Beerblock,Roland Monod,Robert Bresson,Drama,Thriller,Captured French Resistance fighter Lieutenant Fontaine awaits a certain death sentence for espionage in a stark Nazi prison...,1957-08-26,99,,André Devigny
757,7.1,tt2076220,Holy Motors,2012,Denis Lavant,Edith Scob,Eva Mendes,Kylie Minogue,Leos Carax,Drama,Fantasy,"From dawn to dusk, a few hours in the shadowy life of a mystic man named Monsieur Oscar.",2012-07-04,115,,Leos Carax
758,7.6,tt0409459,Watchmen,2009,Jackie Earle Haley,Patrick Wilson,Carla Gugino,Malin Akerman,Zack Snyder,Action,Drama,"In 1985 where former superheroes exist, the murder of a colleague sends active vigilante Rorschach into his own sprawling investigation, uncovering something that could completely change the course of history as we know it.",2009-03-06,162,This city is afraid of me. I've seen its true face.,David Hayter
759,7.3,tt0119094,Face/Off,1997,John Travolta,Nicolas Cage,Joan Allen,Alessandro Nivola,John Woo,Action,Crime,"In order to foil an extortion plot, an FBI agent undergoes a face-transplant surgery and assumes the identity and physical appearance of a ruthless terrorist, but the plan turns from bad to worse when the same criminal impersonates the cop.",1997-06-27,138,"In order to catch him, he must become him.",Mike Werb
760,8.2,tt0266543,Finding Nemo,2003,Albert Brooks,Ellen DeGeneres,Alexander Gould,Willem Dafoe,Andrew Stanton,Animation,Adventure,"After his son is captured in the Great Barrier Reef and taken to Sydney, a timid clownfish sets out on a journey to bring him home.",2003-05-30,100,71% of the Earth's surface is covered by water. That's a lot of space to find one fish.,Andrew Stanton
761,6.8,tt1054606,The Imaginarium of Doctor Parnassus,2009,Christopher Plummer,Lily Cole,Heath Ledger,Andrew Garfield,Terry Gilliam,Adventure,Fantasy,A traveling theater company gives its audience much more than they were expecting.,2010-01-08,123,The man who tried to cheat the devil.,Terry Gilliam
762,8.1,tt0198781,"Monsters, Inc.",2001,Billy Crystal,John Goodman,Mary Gibbs,Steve Buscemi,Pete Docter,Animation,Adventure,"In order to power the city, monsters have to scare children so that they scream. However, the children are toxic to the monsters, and after a child gets through, two monsters realize things may not be what they think.",2001-11-02,92,"Monsters, Inc. : We Scare Because We Care",Pete Docter
763,8.1,tt1979320,Rush,2013,Daniel Brühl,Chris Hemsworth,Olivia Wilde,Alexandra Maria Lara,Ron Howard,Action,Biography,The merciless 1970s rivalry between Formula One rivals James Hunt and Niki Lauda.,2013-09-27,123,Everyone's driven by something.,Peter Morgan
764,7.0,tt1663662,Pacific Rim,2013,Idris Elba,Charlie Hunnam,Rinko Kikuchi,Charlie Day,Guillermo del Toro,Action,Adventure,"As a war between humankind and monstrous sea creatures wages on, a former pilot and a trainee are paired up to drive a seemingly obsolete special weapon in a desperate effort to save the world from the apocalypse.",2013-07-12,131,Go big or go extinct,Travis Beacham
765,8.3,tt0057115,The Great Escape,1963,Steve McQueen,James Garner,Richard Attenborough,Charles Bronson,John Sturges,Adventure,Drama,Allied prisoners of war plan for several hundred of their number to escape from a German camp during World War II.,1963-07-04,172,put a fence in front of these men...and they'll climb it...,Paul Brickhill
766,7.7,tt0765443,Eastern Promises,2007,Naomi Watts,Viggo Mortensen,Armin Mueller-Stahl,Josef Altin,David Cronenberg,Crime,Mystery,A Russian teenager living in London who dies during childbirth leaves clues to a midwife in her journal that could tie her child to a rape involving a violent Russian mob family.,2007-09-21,100,Every sin leaves a mark.,Steven Knight
767,7.5,tt0449467,Babel,2006,Brad Pitt,Cate Blanchett,Gael García Bernal,Mohamed Akhzam,Alejandro G. Iñárritu,Drama,nan,"Tragedy strikes a married couple on vacation in the Moroccan desert, touching off an interlocking story involving four different families.",2006-11-10,143,If You Want to be Understood...Listen,Guillermo Arriaga
768,8.2,tt0071315,Chinatown,1974,Jack Nicholson,Faye Dunaway,John Huston,Perry Lopez,Roman Polanski,Drama,Mystery,"A private detective hired to expose an adulterer finds himself caught up in a web of deceit, corruption and murder.",1974-06-20,130,You get tough. You get tender. You get close to each other. Maybe you even get close to the truth.,Robert Towne
769,8.0,tt0378194,Kill Bill: Vol. 2,2004,Uma Thurman,David Carradine,Michael Madsen,Daryl Hannah,Quentin Tarantino,Action,Crime,"The Bride continues her quest of vengeance against her former boss and lover Bill, the reclusive bouncer Budd and the treacherous, one-eyed Elle.",2004-04-16,137,The 5th film by Quentin Tarantino,Quentin Tarantino
770,8.0,tt0114746,Twelve Monkeys,1995,Bruce Willis,Madeleine Stowe,Brad Pitt,Joseph Melito,Terry Gilliam,Mystery,Sci-Fi,"In a future world devastated by disease, a convict is sent back in time to gather information about the man-made virus that wiped out most of the human population on the planet.",1996-01-05,129,The future is history.,Chris Marker
771,7.7,tt0120255,The Sweet Hereafter,1997,Ian Holm,Sarah Polley,Caerthan Banks,Tom McCamus,Atom Egoyan,Drama,nan,"A bus crash in a small town brings a lawyer to the town to defend the families, but he discovers that everything is not what it seems.",1997-11-21,112,Sometimes courage comes from the most surprising places.,Russell Banks
772,6.9,tt0102266,The Last Boy Scout,1991,Bruce Willis,Damon Wayans,Chelsea Field,Noble Willingham,Tony Scott,Action,Thriller,A down and out cynical detective teams up with a down and out ex-quarterback to try and solve a murder...,1991-12-13,105,The goal is to survive.,Shane Black
773,8.0,tt0072890,Dog Day Afternoon,1975,Al Pacino,John Cazale,Penelope Allen,Sully Boyar,Sidney Lumet,Crime,Drama,A man robs a bank to pay for his lover's operation; it turns into a hostage situation and a media circus.,1975-09-21,125,"The robbery should have taken 10 minutes. 4 hours later, the bank was like a circus sideshow. 8 hours later, it was the hottest thing on live T.V. 12 hours later, it was all history. And it's all true",Frank Pierson
774,7.7,tt0128445,Rushmore,1998,Jason Schwartzman,Bill Murray,Olivia Williams,Seymour Cassel,Wes Anderson,Comedy,Drama,The extracurricular king of Rushmore preparatory school is put on academic probation.,1999-02-19,93,"""She was my Rushmore""",Wes Anderson
775,6.7,tt0119802,Monument Ave.,1998,Denis Leary,Ian Hart,Jason Barry,Lenny Clarke,Ted Demme,Crime,Drama,A small time hoodlum is divided between his conscience and loyalty to his boss when his cousin is murdered.,1998-09-25,93,Every city has one.,Mike Armstrong
776,7.6,tt0475276,United 93,2006,David Alan Basche,Olivia Thirlby,Liza Colón-Zayas,J.J. Johnson,Paul Greengrass,Drama,History,"A real-time account of the events on United Flight 93, one of the planes hijacked on September 11th, 2001 that crashed near Shanksville, Pennsylvania when passengers foiled the terrorist plot.",2006-04-28,111,"September 11, 2001. Four planes were hijacked. Three of them reached their target. This is the story of the fourth.",Paul Greengrass
777,7.4,tt1232207,Capitalism: A Love Story,2009,Michael Moore,William Black,Jimmy Carter,Elijah Cummings,Michael Moore,Documentary,Crime,An examination of the social costs of corporate interests pursuing profits at the expense of the public good.,2009-10-02,127,,Michael Moore
778,8.4,tt0053125,North by Northwest,1959,Cary Grant,Eva Marie Saint,James Mason,Jessie Royce Landis,Alfred Hitchcock,Action,Adventure,"A hapless New York advertising executive is mistaken for a government agent by a group of foreign spies, and is pursued across the country while he looks for a way to survive.",1959-09-26,136,Alfred Hitchcock takes you.... North by Northwest!,Ernest Lehman
779,7.8,tt0158983,"South Park: Bigger, Longer & Uncut",1999,Trey Parker,Matt Stone,Mary Kay Bergman,Isaac Hayes,Trey Parker,Animation,Comedy,"When the four boys see an R-rated movie featuring Canadians Terrance & Phillip, they are pronounced ""corrupted"", and their parents pressure the United States to wage war against Canada.",1999-06-30,81,Warning: This movie will warp your fragile little minds.,Trey Parker
780,6.3,tt0171580,Nurse Betty,2000,Renée Zellweger,Morgan Freeman,Chris Rock,Greg Kinnear,Neil LaBute,Comedy,Crime,Comedy about a widow's post-traumatic obsession with a soap star.,2000-09-08,110,She's chasing a dream... they're chasing her.,John C. Richards
781,7.2,tt0114558,Strange Days,1995,Ralph Fiennes,Angela Bassett,Juliette Lewis,Tom Sizemore,Kathryn Bigelow,Action,Crime,A former cop turned street-hustler accidentally uncovers a conspiracy in Los Angeles in 1999.,1995-10-13,145,you know you want it,James Cameron
782,8.4,tt0087843,Once Upon a Time in America,1984,Robert De Niro,James Woods,Elizabeth McGovern,Joe Pesci,Sergio Leone,Crime,Drama,"A former Prohibition-era Jewish gangster returns to the Lower East Side of Manhattan over thirty years later, where he once again must confront the ghosts and regrets of his old life.",1984-06-01,139,"Crime, passion and lust for power - Sergio Leone's explosive saga of gangland America. [Australia Theatrical]",Harry Grey
783,7.6,tt0109506,The Crow,1994,Brandon Lee,Michael Wincott,Rochelle Davis,Ernie Hudson,Alex Proyas,Action,Drama,A man brutally murdered comes back to life as an undead avenger of his and his fiancée's murder.,1994-05-13,102,It Can't Rain All The Time,James O'Barr
784,6.8,tt0167190,Hellboy,2004,Ron Perlman,Doug Jones,Selma Blair,John Hurt,Guillermo del Toro,Action,Fantasy,"A demon, raised from infancy after being conjured by and rescued from the Nazis, grows up to become a defender against the forces of darkness.",2004-04-02,122,From the Dark Side to Our Side,Guillermo del Toro
785,7.8,tt0472043,Apocalypto,2006,Gerardo Taracena,Raoul Max Trujillo,Dalia Hernández,Rudy Youngblood,Mel Gibson,Action,Adventure,"As the Mayan kingdom faces its decline, the rulers insist the key to prosperity is to build more temples and offer human sacrifices. Jaguar Paw, a young man captured for sacrifice, flees to avoid his fate.",2006-12-08,139,"When the end comes, not everyone is ready to go",Mel Gibson
786,7.6,tt1899353,The Raid: Redemption,2011,Iko Uwais,Ananda George,Ray Sahetapy,Donny Alamsyah,Gareth Evans,Action,Crime,A S.W.A.T. team becomes trapped in a tenement run by a ruthless mobster and his army of killers and thugs.,2012-04-13,101,"1 Ruthless Crime Lord, 20 Elite Cops, 30 Floors of Hell",Gareth Evans
787,7.7,tt0266308,Battle Royale,2000,Tatsuya Fujiwara,Aki Maeda,Tarô Yamamoto,Takeshi Kitano,Kinji Fukasaku,Adventure,Drama,"In the future, the Japanese government captures a class of ninth-grade students and forces them to kill each other under the revolutionary ""Battle Royale"" act.",2000-12-16,114,"Their Game, No Rules, No Prisoners",Koushun Takami
788,8.0,tt0379786,Serenity,2005,Nathan Fillion,Gina Torres,Chiwetel Ejiofor,Alan Tudyk,Joss Whedon,Action,Adventure,The crew of the ship Serenity try to evade an assassin sent to recapture one of their numbers who is telepathic.,2005-09-30,119,Can't stop the signal.,Joss Whedon
789,6.8,tt0074256,Bugsy Malone,1976,Jodie Foster,Scott Baio,Florrie Dugger,John Cassisi,Alan Parker,Comedy,Crime,The classic gangster story of Bugsy Malone told with an all-child cast.,1976-09-15,93,Every year brings a great movie. Every decade a great movie musical!,Alan Parker
790,5.8,tt1017460,Splice,2009,Adrien Brody,Sarah Polley,Delphine Chanéac,Brandon McGibbon,Vincenzo Natali,Drama,Horror,Genetic engineers Clive Nicoli and Elsa Kast hope to achieve fame by successfully splicing together the DNA of different animals to create new hybrid animals for medical use.,2010-06-04,104,A secret experiment will break the laws of science and create an animal human hybrid.,Vincenzo Natali
791,6.8,tt1091722,Adventureland,2009,Jesse Eisenberg,Kristen Stewart,Ryan Reynolds,Kelsey Ford,Greg Mottola,Comedy,Drama,"In the summer of 1987, a college graduate takes a 'nowhere' job at his local amusement park, only to find it's the perfect course to get him prepared for the real world.",2009-04-03,107,It was the worst job they ever imagined... and the best time of their lives.,Greg Mottola
792,7.2,tt1399683,Winter's Bone,2010,Jennifer Lawrence,John Hawkes,Garret Dillahunt,Isaiah Stone,Debra Granik,Drama,nan,An unflinching Ozark Mountain girl hacks through dangerous social terrain as she hunts down her drug-dealing father while trying to keep her family intact.,2010-07-16,100,Everyone's got a secret,Debra Granik
793,6.7,tt0465602,Shoot 'Em Up,2007,Clive Owen,Monica Bellucci,Paul Giamatti,Stephen McHattie,Michael Davis,Action,Comedy,"A man named Mr. Smith delivers a woman's baby during a shootout, and is then called upon to protect the newborn from the army of gunmen.",2007-09-07,86,I'm a British nanny and I'm dangerous.,Michael Davis
794,7.4,tt0074156,Assault on Precinct 13,1976,Austin Stoker,Darwin Joston,Laurie Zimmer,Martin West,John Carpenter,Action,Crime,A police sergeant and an unlikely band of criminals defend a closing LA precinct office on New Years Eve against an army of gang members.,1976-11-05,91,L.A.'s deadliest street gang just declared war on the cops.,John Carpenter
795,7.9,tt0115751,Breaking the Waves,1996,Emily Watson,Stellan Skarsgård,Katrin Cartlidge,Jean-Marc Barr,Lars von Trier,Drama,Romance,"Oilman Jan is paralyzed in an accident. His wife, who prayed for his return, feels guilty; even more, when Jan urges her to have sex with another.",1996-11-13,153,Love is a mighty power.,Lars von Trier
796,7.4,tt0074486,Eraserhead,1977,Jack Nance,Charlotte Stewart,Allen Joseph,Jeanne Bates,David Lynch,Fantasy,Horror,"Henry Spencer tries to survive his industrial environment, his angry girlfriend, and the unbearable screams of his newly born mutant child.",1978-02-03,89,Be warned. The nightmare has not gone away...,David Lynch
797,8.0,tt0327056,Mystic River,2003,Sean Penn,Tim Robbins,Kevin Bacon,Emmy Rossum,Clint Eastwood,Crime,Drama,"With a childhood tragedy that overshadowed their lives, three men are reunited by circumstance when one has a family tragedy.",2003-10-15,138,"We bury our sins, we wash them clean.",Brian Helgeland
798,8.1,tt0093779,The Princess Bride,1987,Cary Elwes,Mandy Patinkin,Robin Wright,Chris Sarandon,Rob Reiner,Adventure,Family,"While home sick in bed, a young boy's grandfather reads him a story called The Princess Bride.",1987-10-09,98,The story of a man and a woman who lived happily ever after. Even though the courtship almost killed them.,William Goldman
799,8.0,tt1663202,The Revenant,2015,Leonardo DiCaprio,Tom Hardy,Will Poulter,Domhnall Gleeson,Alejandro G. Iñárritu,Adventure,Drama,A frontiersman on a fur trading expedition in the 1820s fights for survival after being mauled by a bear and left for dead by members of his own hunting team.,2016-01-08,156,"(n. One who has returned, as if from the dead.)",Mark L. Smith
800,7.8,tt2562232,Birdman or (The Unexpected Virtue of Ignorance),2014,Michael Keaton,Zach Galifianakis,Edward Norton,Andrea Riseborough,Alejandro G. Iñárritu,Comedy,Drama,"Illustrated upon the progress of his latest Broadway play, a former popular actor's struggle to cope with his current life as a wasted actor is shown.",2014-11-14,119,,Alejandro G. Iñárritu
801,7.0,tt0478311,Knocked Up,2007,Seth Rogen,Katherine Heigl,Paul Rudd,Leslie Mann,Judd Apatow,Comedy,Romance,"For fun-loving party animal Ben Stone, the last thing he ever expected was for his one-night stand to show up on his doorstep eight weeks later to tell him she's pregnant with his child.",2007-06-01,129,Save the due date,Judd Apatow
802,7.7,tt0268126,Adaptation.,2002,Nicolas Cage,Meryl Streep,Chris Cooper,Tilda Swinton,Spike Jonze,Comedy,Drama,A lovelorn screenwriter becomes desperate as he tries and fails to adapt 'The Orchid Thief' by Susan Orlean for the screen.,2003-02-14,114,"From the creator of Being John Malkovich, comes the story about the creator of Being John Malkovich.",Susan Orlean
803,7.5,tt0383028,"Synecdoche, New York",2008,Philip Seymour Hoffman,Samantha Morton,Michelle Williams,Catherine Keener,Charlie Kaufman,Comedy,Drama,"A theatre director struggles with his work, and the women in his life, as he creates a life-size replica of New York City inside a warehouse as part of his new play.",2008-11-21,124,,Charlie Kaufman
804,8.0,tt0049730,The Searchers,1956,John Wayne,Jeffrey Hunter,Vera Miles,Ward Bond,John Ford,Adventure,Drama,A Civil War veteran embarks on a journey to rescue his niece from an Indian tribe.,1956-05-26,119,The story that sweeps from the great Southwest to the Canadian border in VistaVision.,Frank S. Nugent
805,8.0,tt0038355,The Big Sleep,1946,Humphrey Bogart,Lauren Bacall,John Ridgely,Martha Vickers,Howard Hawks,Crime,Film-Noir,"Private detective Philip Marlowe is hired by a rich family. Before the complex case is over, he's seen murder, blackmail, and what might be love.",1946-08-31,114,The type of man she hated . . . was the type she wanted !,William Faulkner
806,7.3,tt0448134,Sunshine,2007,Cillian Murphy,Rose Byrne,Chris Evans,Michelle Yeoh,Danny Boyle,Adventure,Sci-Fi,A team of international astronauts are sent on a dangerous mission to reignite the dying Sun with a nuclear fission bomb in 2057.,2007-07-27,107,Dark days are coming.,Alex Garland
807,7.1,tt0355702,Lords of Dogtown,2005,Heath Ledger,Emile Hirsch,Victor Rasuk,Johnny Knoxville,Catherine Hardwicke,Biography,Drama,"The film follows the surf and skateboarding trends that originated in Venice, California during the 1970's.",2005-06-03,107,They came from nothing to change everything.,Stacy Peralta
808,7.4,tt1190536,Black Dynamite,2009,Arsenio Hall,Tommy Davidson,Phyllis Applegate,Obba Babatundé,Scott Sanders,Action,Comedy,Black Dynamite is the greatest African-American action star of the 1970s. When his only brother is killed by The Man it's up to him to find justice.,2010-01-13,84,He's super bad. He's outta sight. He's...,Michael Jai White
809,7.4,tt0074285,Carrie,1976,Sissy Spacek,Piper Laurie,Amy Irving,John Travolta,Brian De Palma,Horror,nan,"Carrie White, a shy, friendless teenage girl who is sheltered by her domineering, religious mother, unleashes her telekinetic powers after being humiliated by her classmates at her senior prom.",1976-11-16,98,You were warned never to push Carrie to the limits. Now you must face the evil consequences.,Stephen King
810,7.7,tt0104940,The Muppet Christmas Carol,1992,Michael Caine,Dave Goelz,Steve Whitmire,Jerry Nelson,Brian Henson,Comedy,Drama,The Muppet characters tell their version of the classic tale of an old and bitter miser's redemption on Christmas Eve.,1992-12-11,89,,Charles Dickens
811,7.8,tt0096163,The Vanishing,1988,Bernard-Pierre Donnadieu,Gene Bervoets,Johanna ter Steege,Gwen Eckhaus,George Sluizer,Crime,Mystery,"Rex and Saskia, a young couple in love, are on vacation. They stop at a busy service station and Saskia is abducted. After three years and no sign of Saskia, Rex begins receiving letters from the abductor.",1988-10-27,107,,Tim Krabbé
