,rating,tconst,title,year,cast1,cast2,cast3,cast4,director,genre1,genre2,plot,date,runtime,tagline,writers
0,8.5,tt2582802,Whiplash,2014,Miles Teller,J.K. Simmons,Melissa Benoist,Paul Reiser,Damien Chazelle,Drama,Music,A promising young drummer enrolls at a cut-throat music conservatory where his dreams of greatness are mentored by an instructor who will stop at nothing to realize a student's potential.,2014-10-15,107,The road to greatness can take you to the edge,Damien Chazelle
1,7.2,tt0113189,GoldenEye,1995,Pierce Brosnan,Sean Bean,Izabella Scorupco,Famke Janssen,Martin Campbell,Action,Adventure,James Bond teams up with the lone survivor of a destroyed Russian research center to stop the hijacking of a nuclear space weapon by a fellow agent formerly believed to be dead.,1995-11-17,130,You know the name. You know the number.,Ian Fleming
2,7.9,tt0055895,Days of Wine and Roses,1962,Jack Lemmon,Lee Remick,Charles Bickford,Jack Klugman,Blake Edwards,Drama,nan,"An alcoholic marries a young woman, whom he systematically addicts to booze so they can share his ""passion"" together.",1963-02-04,117,"This, in its own terrifying way, is a love story.",J.P. Miller
3,6.8,tt0102510,The Naked Gun 2½: The Smell of Fear,1991,Leslie Nielsen,Priscilla Presley,George Kennedy,O.J. Simpson,David Zucker,Comedy,Crime,Lieutenant Drebin discovers that his ex-girlfriend's new beau is involved in a plot to kidnap a scientist who advocates solar energy.,1991-06-28,85,If you see only one movie this year...you ought to get out more often.,Jim Abrahams
4,7.1,tt0424136,Hard Candy,2005,Patrick Wilson,Ellen Page,Sandra Oh,Odessa Rae,David Slade,Crime,Drama,A teenage girl raids a man's home in order to expose him under suspicion that he is a sex offender with pedophilia.,2006-04-28,104,Strangers shouldn't talk to little girls.,Brian Nelson
5,7.1,tt1204342,The Muppets,2011,Amy Adams,Jason Segel,Chris Cooper,Rashida Jones,James Bobin,Adventure,Comedy,A Muppet fanatic with some help from his two human compatriots must regroup the Muppet gang to stop an avaricious oil mogul from taking down one of their precious life-longing treasures.,2011-11-23,103,They're closer than you think.,Jason Segel
6,6.6,tt0196229,Zoolander,2001,Ben Stiller,Owen Wilson,Christine Taylor,Will Ferrell,Ben Stiller,Comedy,nan,"At the end of his career, a clueless fashion model is brainwashed to kill the Prime Minister of Malaysia.",2001-09-28,90,3% Body Fat. 1% Brain Activity.,Drake Sather
7,6.6,tt1764183,Arbitrage,2012,Richard Gere,Susan Sarandon,Brit Marling,Tim Roth,Nicholas Jarecki,Drama,Thriller,A troubled hedge fund magnate desperate to complete the sale of his trading empire makes an error that forces him to turn to an unlikely person for help.,2012-09-14,107,Power is the best alibi.,Nicholas Jarecki
8,7.9,tt0097216,Do the Right Thing,1989,Danny Aiello,Ossie Davis,Ruby Dee,Richard Edson,Spike Lee,Comedy,Drama,"On the hottest day of the year on a street in the Bedford-Stuyvesant section of Brooklyn, everyone's hate and bigotry smolders and builds until it explodes into violence.",1989-07-21,120,"It's the hottest day of the summer. You can do nothing, you can do something, or you can...",Spike Lee
9,7.5,tt0097351,Field of Dreams,1989,Kevin Costner,James Earl Jones,Ray Liotta,Amy Madigan,Phil Alden Robinson,Drama,Family,"An Iowa corn farmer, hearing voices, interprets them as a command to build a baseball diamond in his fields; he does, and the Chicago White Sox come.",1989-05-05,107,"All his life, Ray Kinsella was searching for his dreams. Then one day, his dreams came looking for him.",W.P. Kinsella
10,7.4,tt0128442,Rounders,1998,Matt Damon,Edward Norton,Gretchen Mol,John Malkovich,John Dahl,Crime,Drama,A young man is a reformed gambler who must return to playing big stakes poker to help a friend pay off loan sharks.,1998-09-11,121,You've got to play the hand you're dealt.,David Levien
11,7.4,tt0274309,24 Hour Party People,2002,Steve Coogan,Lennie James,John Thomson,Paul Popplewell,Michael Winterbottom,Biography,Comedy,"In 1976, Tony Wilson sets up Factory Records and brings Manchester's music to the world.",2002-09-20,117,"The unbelievably true story of one man, one movement, the music and madness that was Manchester.",Frank Cottrell Boyce
12,5.8,tt1959490,Noah,2014,Russell Crowe,Jennifer Connelly,Anthony Hopkins,Emma Watson,Darren Aronofsky,Action,Adventure,A man is chosen by his world's creator to undertake a momentous mission before an apocalyptic flood cleanses the world.,2014-03-28,138,Rediscover the epic story of one man and the most remarkable event in our history.,Darren Aronofsky
13,7.3,tt0145653,Angela's Ashes,1999,Emily Watson,Robert Carlyle,Joe Breen,Ciaran Owens,Alan Parker,Drama,nan,"Based on the best selling autobiography by Irish expat Frank McCourt, Angela's Ashes follows the experiences...",2000-01-21,145,The Hopes of a Mother. The Dreams of a Father. The Fate of a Child.,Frank McCourt
14,7.6,tt0373469,Kiss Kiss Bang Bang,2005,Robert Downey Jr.,Val Kilmer,Michelle Monaghan,Corbin Bernsen,Shane Black,Comedy,Crime,"A murder mystery brings together a private eye, a struggling actress, and a thief masquerading as an actor.",2005-11-18,103,SeX. MurdEr. MyStery. Welcome to the party.,Brett Halliday
15,7.9,tt1182345,Moon,2009,Sam Rockwell,Kevin Spacey,Dominique McElligott,Rosie Shaw,Duncan Jones,Drama,Mystery,"Astronaut Sam Bell has a quintessentially personal encounter toward the end of his three-year stint on the Moon, where he, working alongside his computer, GERTY, sends back to Earth parcels of a resource that has helped diminish our planet's power problems.",2009-07-10,97,The last place you'd ever expect to find yourself,Duncan Jones
16,8.3,tt0070735,The Sting,1973,Paul Newman,Robert Redford,Robert Shaw,Charles Durning,George Roy Hill,Comedy,Crime,"In Chicago in September 1936, a young con man seeking revenge for his murdered partner teams up with a master of the big con to win a fortune from a criminal banker.",1973-12-25,129,"Recapture ""the STING Experience"". REMEMBER HOW GOOD THE FEEL WAS THE FIRST TIME (re-release)",David S. Ward
17,7.4,tt1193138,Up in the Air,2009,George Clooney,Vera Farmiga,Anna Kendrick,Jason Bateman,Jason Reitman,Drama,Romance,"With a job traveling around the country firing people, Ryan Bingham enjoys his life living out of a suitcase, but finds that lifestyle threatened by the presence of a new hire and a potential love interest.",2009-12-23,109,The story of a man ready to make a connection.,Walter Kirn
18,7.9,tt0100150,Miller's Crossing,1990,Gabriel Byrne,Albert Finney,John Turturro,Marcia Gay Harden,Joel Coen,Crime,Drama,"Tom Regan, an advisor to a Prohibition-era crime boss, tries to keep the peace between warring mobs but gets caught in divided loyalties.",1990-10-05,115,What's the rumpus?,Joel Coen
19,7.7,tt0456912,A Bittersweet Life,2005,Jung-min Hwang,Yu-mi Jeong,Ku Jin,Hae-gon Kim,Jee-woon Kim,Action,Crime,Things go wrong for a high ranking mobster when he doesn't proceed by his boss's orders.,2005-04-01,120,"When doing right goes very, very wrong.",Jee-woon Kim
20,7.1,tt0117039,Michael Collins,1996,Liam Neeson,Aidan Quinn,Julia Roberts,Ian Hart,Neil Jordan,Biography,Drama,"Neil Jordan's historical biopic of Irish revolutionary Michael Collins, the man who led a guerrilla war against the UK, helped negotiate the creation of the Irish Free State, and led the National Army during the Irish Civil War.",1996-10-25,133,"Ireland, 1916. His dreams inspired hope. His words inspired passion. His courage forged a nation's destiny.",Neil Jordan
21,7.8,tt0100157,Misery,1990,James Caan,Kathy Bates,Richard Farnsworth,Frances Sternhagen,Rob Reiner,Crime,Drama,"After a famous author is rescued from a car crash by a fan of his novels, he comes to realize that the care he is receiving is only the beginning of a nightmare of captivity and abuse.",1990-11-30,107,This Christmas there will be... Misery.,Stephen King
22,7.0,tt0208874,The Contender,2000,Joan Allen,Gary Oldman,Jeff Bridges,Christian Slater,Rod Lurie,Drama,Thriller,"Senator Laine Hanson is a contender for US Vice President, but information and disinformation about her past surfaces that threatens to de-rail her confirmation.",2000-10-13,126,Sometimes you can assassinate a leader without firing a shot.,Rod Lurie
23,5.5,tt0464154,Piranha 3D,2010,Elisabeth Shue,Jerry O'Connell,Richard Dreyfuss,Ving Rhames,Alexandre Aja,Comedy,Horror,"After a sudden underwater tremor sets free scores of the prehistoric man-eating fish, an unlikely group of strangers must band together to stop themselves from becoming fish food for the area's new razor-toothed residents.",2010-08-20,88,This Summer 3D Shows Its Teeth,Pete Goldfinger
24,6.5,tt0097428,Ghostbusters II,1989,Bill Murray,Dan Aykroyd,Sigourney Weaver,Harold Ramis,Ivan Reitman,Action,Comedy,The discovery of a massive river of ectoplasm and a resurgence of spectral activity allows the staff of Ghostbusters to revive the business.,1989-06-16,108,An Ivan Reitman film,Dan Aykroyd
25,6.2,tt0442933,Beowulf,2007,Ray Winstone,Crispin Glover,Angelina Jolie,Robin Wright,Robert Zemeckis,Animation,Action,"The warrior Beowulf must fight and defeat the monster Grendel who is terrorizing Denmark, and later, Grendel's mother, who begins killing out of revenge.",2007-11-16,115,Pride is the curse.,Neil Gaiman
26,6.5,tt0102175,Jungle Fever,1991,Wesley Snipes,Annabella Sciorra,Spike Lee,Ossie Davis,Spike Lee,Drama,Romance,Friends and family of a married black architect react in different ways to his affair with an Italian secretary.,1991-06-07,132,,Spike Lee
27,6.6,tt0116378,The Funeral,1996,Christopher Walken,Chris Penn,Annabella Sciorra,Isabella Rossellini,Abel Ferrara,Crime,Drama,"New York City, the 1930s. A powerful crime family is caught in a lethal crossfire between union organizers and brutal corporate bosses...",1996-11-01,99,"Once you pull the trigger, there's no going back.",Nicholas St. John
28,7.8,tt1045658,Silver Linings Playbook,2012,Bradley Cooper,Jennifer Lawrence,Robert De Niro,Jacki Weaver,David O. Russell,Comedy,Drama,"After a stint in a mental institution, former teacher Pat Solitano moves back in with his parents and tries to reconcile with his ex-wife. Things get more challenging when Pat meets Tiffany, a mysterious girl with problems of her own.",2012-12-25,122,Watch for the signs,David O. Russell
29,7.3,tt0095031,Dirty Rotten Scoundrels,1988,Steve Martin,Michael Caine,Glenne Headly,Anton Rodgers,Frank Oz,Comedy,Crime,"Two con men try to settle their rivalry by betting on who can swindle a young American heiress out of $50,000 first.",1988-12-14,110,Nice guys finish last.  Meet the winners.,Dale Launer
30,8.0,tt0947798,Black Swan,2010,Natalie Portman,Mila Kunis,Vincent Cassel,Winona Ryder,Darren Aronofsky,Drama,Thriller,"A committed dancer wins the lead role in a production of Tchaikovsky's ""Swan Lake"" only to find herself struggling to maintain her sanity.",2010-12-17,108,,Mark Heyman
31,7.3,tt0120663,Eyes Wide Shut,1999,Tom Cruise,Nicole Kidman,Todd Field,Sydney Pollack,Stanley Kubrick,Drama,Mystery,"A New York City doctor, who is married to an art curator, pushes himself on a harrowing and dangerous night-long odyssey of sexual and moral discovery after his wife admits that she once almost cheated on him.",1999-07-16,159,Cruise. Kidman. Kubrick.,Stanley Kubrick
32,7.2,tt0118804,The Butcher Boy,1997,Stephen Rea,Fiona Shaw,Eamonn Owens,Alan Boyle,Neil Jordan,Comedy,Drama,"Francie and Joe live the usual playful, fantasy filled childhoods of normal boys. However, with a violent...",1998-02-20,110,This little piggy laughed all the way home!,Pat McCabe
33,7.8,tt1843866,Captain America: The Winter Soldier,2014,Chris Evans,Samuel L. Jackson,Scarlett Johansson,Robert Redford,Anthony Russo,Action,Adventure,"As Steve Rogers struggles to embrace his role in the modern world, he teams up with a fellow Avenger and S.H.I.E.L.D agent, Black Widow, to battle a new threat from history: an assassin known as the Winter Soldier.",2014-04-04,136,In heroes we trust.,Christopher Markus
34,7.7,tt0120669,Fear and Loathing in Las Vegas,1998,Johnny Depp,Benicio Del Toro,Tobey Maguire,Ellen Barkin,Terry Gilliam,Adventure,Comedy,An oddball journalist and his psychopathic lawyer travel to Las Vegas for a series of psychedelic escapades.,1998-05-22,118,Give us your brain for two hours and you will never be the same again.....(Icelandic),Hunter S. Thompson
35,6.7,tt0292644,The Rules of Attraction,2002,James Van Der Beek,Ian Somerhalder,Shannyn Sossamon,Jessica Biel,Roger Avary,Comedy,Drama,"The incredibly spoiled and overprivileged students of Camden College are a backdrop for an unusual love triangle between a drug dealer, a virgin and a bisexual classmate.",2002-10-11,110,We all run on instinct.,Bret Easton Ellis
36,7.6,tt0887912,The Hurt Locker,2008,Jeremy Renner,Anthony Mackie,Brian Geraghty,Guy Pearce,Kathryn Bigelow,Drama,History,"During the Iraq War, a Sergeant recently assigned to an army bomb squad is put at odds with his squad mates due to his maverick way of handling his work.",2009-07-31,131,You'll know when you're in it.,Mark Boal
37,6.7,tt0830515,Quantum of Solace,2008,Daniel Craig,Olga Kurylenko,Mathieu Amalric,Judi Dench,Marc Forster,Action,Adventure,"James Bond descends into mystery as he tries to stop a mysterious organization from eliminating a country's most valuable resource. All the while, he still tries to seek revenge over the death of his love.",2008-11-14,106,,Paul Haggis
38,6.6,tt0088000,Revenge of the Nerds,1984,Robert Carradine,Anthony Edwards,Timothy Busfield,Andrew Cassese,Jeff Kanew,Comedy,nan,"At Adams College, a group of bullied outcasts and misfits resolve to fight back for their peace and self-respect.",1984-08-10,90,"They've been laughed at, picked on and put down. But now it's time for the odd to get even! Their time has come!",Tim Metcalfe
39,8.0,tt1655442,The Artist,2011,Jean Dujardin,Bérénice Bejo,John Goodman,James Cromwell,Michel Hazanavicius,Comedy,Drama,"A silent movie star meets a young dancer, but the arrival of talking pictures sends their careers in opposite directions.",2012-01-20,100,,Michel Hazanavicius
40,7.2,tt0119164,The Full Monty,1997,Robert Carlyle,Tom Wilkinson,Mark Addy,William Snape,Peter Cattaneo,Comedy,Drama,"Six unemployed steel workers form a male striptease act. The women cheer them on to go for ""the full monty"" - total nudity.",1997-09-19,91,Six men. With nothing to lose. Who dare to go....,Simon Beaufoy
41,7.0,tt1446714,Prometheus,2012,Noomi Rapace,Logan Marshall-Green,Michael Fassbender,Charlize Theron,Ridley Scott,Adventure,Mystery,Following clues to the origin of mankind a team journey across the universe and find a structure on a distant moon containing a monolithic statue of a humanoid head and stone cylinders of alien blood but they soon find they are not alone.,2012-06-08,124,The search for our beginning could lead to our end,Jon Spaihts
42,6.9,tt2382396,Joe,2013,Nicolas Cage,Tye Sheridan,Gary Poulter,Ronnie Gene Blevins,David Gordon Green,Drama,,"An ex-con, who is the unlikeliest of role models, meets a 15-year-old boy and is faced with the choice of redemption or ruin.",2014-04-11,117,,Gary Hawkins
43,8.4,tt0364569,Oldboy,2003,Min-sik Choi,Ji-tae Yu,Hye-jeong Kang,Dae-han Ji,Chan-wook Park,Drama,Mystery,"After being kidnapped and imprisoned for fifteen years, Oh Dae-Su is released, only to find that he must find his captor in five days.",2003-11-21,120,"15 years of imprisonment, five days of vengeance",Garon Tsuchiya
44,8.3,tt0372784,Batman Begins,2005,Christian Bale,Michael Caine,Ken Watanabe,Liam Neeson,Christopher Nolan,Action,Adventure,"After training with his mentor, Batman begins his fight to free crime-ridden Gotham City from the corruption that Scarecrow and the League of Shadows have cast upon it.",2005-06-15,140,The legend begins.,Bob Kane
45,8.5,tt0078788,Apocalypse Now,1979,Martin Sheen,Marlon Brando,Robert Duvall,Frederic Forrest,Francis Ford Coppola,Drama,War,"During the Vietnam War, Captain Willard is sent on a dangerous mission into Cambodia to assassinate a renegade colonel who has set himself up as a god among a local tribe.",1979-08-15,153,The Horror. . . The Horror. . .,John Milius
46,7.2,tt0088993,Day of the Dead,1985,Lori Cardille,Terry Alexander,Joseph Pilato,Jarlath Conroy,George A. Romero,Action,Drama,A small group of military officers and scientists dwell in an underground bunker as the world above is overrun by zombies.,1985-07-19,96,The Dead have waited. The day has come.,George A. Romero
47,7.5,tt0032910,Pinocchio,1940,Dickie Jones,Christian Rub,Mel Blanc,Don Brodie,Norman Ferguson,Animation,Family,"A living puppet, with the help of a cricket as his conscience, must prove himself worthy to become a real boy.",1940-02-23,88,Disney's all-time family classic is back ...No strings attached! [1987 re-release Australia],Carlo Collodi
48,7.5,tt0099871,Jacob's Ladder,1990,Tim Robbins,Elizabeth Peña,Danny Aiello,Matt Craven,Adrian Lyne,Drama,Horror,"Mourning his dead child, a haunted Vietnam War veteran attempts to discover his past while suffering from a severe case of dissociation. To do so, he must decipher reality and life from his own dreams, delusion, and perception of death.",1990-11-02,113,The most frightening thing about Jacob Singer's nightmare is that he isn't dreaming.,Bruce Joel Rubin
49,7.4,tt1790885,Zero Dark Thirty,2012,Jessica Chastain,Joel Edgerton,Chris Pratt,Mark Strong,Kathryn Bigelow,Drama,History,"A chronicle of the decade-long hunt for al-Qaeda terrorist leader Osama bin Laden after the September 2001 attacks, and his death at the hands of the Navy S.E.A.L.s Team 6 in May 2011.",2013-01-11,157,The greatest manhunt in history.,Mark Boal
50,8.2,tt0978762,Mary and Max,2009,Toni Collette,Philip Seymour Hoffman,Eric Bana,Barry Humphries,Adam Elliot,Animation,Comedy,"A tale of friendship between two unlikely pen pals: Mary, a lonely, eight-year-old girl living in the suburbs of Melbourne, and Max, a forty-four-year old, severely obese man living in New York.",2009-04-09,92,Two unlikely people. Two different worlds come together in a story about a most unusual friendship.,Adam Elliot
51,7.7,tt0455590,The Last King of Scotland,2006,James McAvoy,Forest Whitaker,Gillian Anderson,Kerry Washington,Kevin Macdonald,Biography,Drama,Based on the events of the brutal Ugandan dictator Idi Amin's regime as seen by his personal physician during the 1970's.,2007-01-19,123,Charming. Magnetic. Murderous.,Peter Morgan
52,8.0,tt3544112,Sing Street,2016,Ferdia Walsh-Peelo,Aidan Gillen,Maria Doyle Kennedy,Jack Reynor,John Carney,Comedy,Drama,A boy growing up in Dublin during the 1980s escapes his strained family life by starting a band to impress the mysterious girl he likes.,2016-03-17,106,"Boy meets girl, girl unimpressed, boy starts band",John Carney
53,7.2,tt0111503,True Lies,1994,Arnold Schwarzenegger,Jamie Lee Curtis,Tom Arnold,Bill Paxton,James Cameron,Action,Comedy,"A fearless, globe-trotting, terrorist-battling secret agent has his life turned upside down when he discovers his wife might be having an affair with a used car salesman.",1994-07-15,141,"When he said I do, he never said what he did.",Claude Zidi
54,7.0,tt0066214,Performance,1970,James Fox,Mick Jagger,Anita Pallenberg,Michèle Breton,Donald Cammell,Crime,Drama,"Chas, a violent and psychotic East London gangster needs a place to lie low after a hit that should never have been carried out...",1970-09-04,105,See them all in a film about fantasy. And reality. Vice. And versa.,Donald Cammell
55,7.7,tt0111507,Three Colors: White,1994,Zbigniew Zamachowski,Julie Delpy,Janusz Gajos,Jerzy Stuhr,Krzysztof Kieslowski,Comedy,Drama,Second of a trilogy of films dealing with contemporary French society shows a Polish immigrant who wants to get even with his former wife.,1994-06-10,91,,Krzysztof Kieslowski
56,7.8,tt0106977,The Fugitive,1993,Harrison Ford,Tommy Lee Jones,Sela Ward,Julianne Moore,Andrew Davis,Action,Crime,"Dr. Richard Kimble, unjustly accused of murdering his wife, must find the real killer while being the target of a nationwide manhunt.",1993-08-06,130,A murdered wife. A one-armed man. An obsessed detective. The chase begins.,Jeb Stuart
57,6.9,tt0116778,Kingpin,1996,Woody Harrelson,Randy Quaid,Bill Murray,Vanessa Angel,Bobby Farrelly,Comedy,Sport,"A star bowler whose career was prematurely ""cut off"" hopes to ride a new prodigy to success and riches.",1996-07-26,117,A comedy right up your alley.,Barry Fanaro
58,7.5,tt0338751,The Aviator,2004,Leonardo DiCaprio,Cate Blanchett,Kate Beckinsale,John C. Reilly,Martin Scorsese,Biography,Drama,A biopic depicting the early years of legendary director and aviator Howard Hughes' career from the late 1920s to the mid-1940s.,2004-12-25,170,"For some men, the sky was the limit. For him, it was just the beginning.",John Logan
59,7.6,tt0095631,Midnight Run,1988,Robert De Niro,Charles Grodin,Yaphet Kotto,John Ashton,Martin Brest,Action,Comedy,"An accountant is chased by bounty hunters, the FBI, and the Mafia after jumping bail.",1988-07-20,126,A tough bounty hunter. A sensitive criminal.,George Gallo
60,7.9,tt0083866,E.T. the Extra-Terrestrial,1982,Henry Thomas,Drew Barrymore,Peter Coyote,Dee Wallace,Steven Spielberg,Family,Sci-Fi,A troubled child summons the courage to help a friendly alien escape Earth and return to his home world.,1982-06-11,120,He is afraid. He is totally alone. He is 3 million light years from home.,Melissa Mathison
61,8.1,tt0246578,Donnie Darko,2001,Jake Gyllenhaal,Jena Malone,Mary McDonnell,Holmes Osborne,Richard Kelly,Drama,Sci-Fi,"A troubled teenager is plagued by visions of a man in a large rabbit suit who manipulates him to commit a series of crimes, after he narrowly escapes a bizarre accident.",2001-10-26,113,Life is one long insane trip. Some people just have better directions.,Richard Kelly
62,8.0,tt1139797,Let the Right One In,2008,Kåre Hedebrant,Lina Leandersson,Per Ragnar,Henrik Dahl,Tomas Alfredson,Drama,Horror,"Oskar, an overlooked and bullied boy, finds love and revenge through Eli, a beautiful but peculiar girl.",2008-12-12,115,"Eli is 12 years old. She's been 12 for over 200 years and, she just moved in next door.",John Ajvide Lindqvist
63,7.8,tt0398286,Tangled,2010,Mandy Moore,Zachary Levi,Donna Murphy,Ron Perlman,Nathan Greno,Animation,Adventure,"The magically long-haired Rapunzel has spent her entire life in a tower, but now that a runaway thief has stumbled upon her, she is about to discover the world for the first time, and who she really is.",2010-11-24,100,They're taking adventure to new lengths.,Dan Fogelman
64,7.4,tt0107507,Manhattan Murder Mystery,1993,Woody Allen,Diane Keaton,Jerry Adler,Lynn Cohen,Woody Allen,Comedy,Mystery,A middle-aged couple suspects foul play when their neighbor's wife suddenly drops dead.,1993-08-18,104,,Woody Allen
65,7.6,tt0104257,A Few Good Men,1992,Tom Cruise,Jack Nicholson,Demi Moore,Kevin Bacon,Rob Reiner,Drama,Thriller,Neo military lawyer Kaffee defends Marines accused of murder; they contend they were acting under orders.,1992-12-11,138,"In the heart of the nation's capital, in a courthouse of the U.S. government, one man will stop at nothing to keep his honor, and one will stop at nothing to find the truth.",Aaron Sorkin
66,7.1,tt0120188,Three Kings,1999,George Clooney,Mark Wahlberg,Ice Cube,Spike Jonze,David O. Russell,Action,Adventure,"In the aftermath of the Persian Gulf War, 4 soldiers set out to steal gold that was stolen from Kuwait, but they discover people who desperately need their help.",1999-10-01,114,In a war without heroes they are kings,John Ridley
67,7.5,tt0067866,El Topo,1970,Alejandro Jodorowsky,Brontis Jodorowsky,José Legarreta,Alfonso Arau,Alejandro Jodorowsky,Drama,Western,A mysterious black-clad gunfighter wanders a mystical Western landscape encountering multiple bizarre characters.,1971-04-15,125,The Definitive Cult Spaghetti Western,Alejandro Jodorowsky
68,7.3,tt1596343,Fast Five,2011,Vin Diesel,Paul Walker,Dwayne Johnson,Jordana Brewster,Justin Lin,Action,Crime,Dominic Toretto and his crew of street racers plan a massive heist to buy their freedom while in the sights of a powerful Brazilian drug lord and a dangerous federal agent.,2011-04-29,131,Feel the Speed. Feel the Rush.,Chris Morgan
69,7.4,tt2381249,Mission: Impossible - Rogue Nation,2015,Tom Cruise,Rebecca Ferguson,Jeremy Renner,Simon Pegg,Christopher McQuarrie,Action,Adventure,"Ethan and team take on their most impossible mission yet, eradicating the Syndicate - an International rogue organization as highly skilled as they are, committed to destroying the IMF.",2015-07-31,131,Go rogue,Christopher McQuarrie
70,7.0,tt1213663,The World's End,2013,Simon Pegg,Nick Frost,Martin Freeman,Rosamund Pike,Edgar Wright,Action,Comedy,Five friends who reunite in an attempt to top their epic pub crawl from twenty years earlier unwittingly become humanity's only hope for survival.,2013-08-23,109,Good food. Fine ales. Total Annihilation.,Simon Pegg
71,7.3,tt0069995,Don't Look Now,1973,Julie Christie,Donald Sutherland,Hilary Mason,Clelia Matania,Nicolas Roeg,Drama,Horror,"A married couple grieving the recent death of their young daughter are in Venice when they encounter two elderly sisters, one of whom is psychic and brings a warning from beyond.",1974-01-01,110,A psychic thriller.,Daphne Du Maurier
72,7.9,tt0120363,Toy Story 2,1999,Tom Hanks,Tim Allen,Joan Cusack,Kelsey Grammer,John Lasseter,Animation,Adventure,"When Woody is stolen by a toy collector, Buzz and his friends vow to rescue him, but Woody finds the idea of immortality in a museum tempting.",1999-11-24,92,"""Oooh...3-D"" (USA 2009 re-release)",John Lasseter
