,rating,tconst,title,year,cast1,cast2,cast3,cast4,director,genre1,genre2,plot,date,runtime,tagline,writers
442,7.6,tt0103873,Dead Alive,1992,Timothy Balme,Diana Peñalver,Elizabeth Moody,Ian Watkin,Peter Jackson,Comedy,Horror,"A young man's mother is bitten by a Sumatran rat-monkey. She gets sick and dies, at which time she comes back to life, killing and eating dogs, nurses, friends, and neighbors.",1993-02-12,85,Some things won't stay down... even after they die.,Stephen Sinclair
443,7.3,tt0272338,Punch-Drunk Love,2002,Adam Sandler,Emily Watson,Philip Seymour Hoffman,Jason Andrews,Paul Thomas Anderson,Comedy,Drama,"A psychologically troubled novelty supplier is nudged towards a romance with an English woman, all the while being extorted by a phone-sex line run by a crooked mattress salesman, and purchasing stunning amounts of pudding.",2002-11-01,95,,Paul Thomas Anderson
444,8.6,tt0034583,Casablanca,1942,Humphrey Bogart,Ingrid Bergman,Paul Henreid,Claude Rains,Michael Curtiz,Drama,Romance,"In Casablanca, Morocco in December 1941, a cynical American expatriate meets a former lover, with unforeseen complications.",1943-01-23,102,They had a date with fate in Casablanca!,Julius J. Epstein
445,8.9,tt0060196,"The Good, the Bad and the Ugly",1966,Clint Eastwood,Eli Wallach,Lee Van Cleef,Aldo Giuffrè,Sergio Leone,Western,nan,A bounty hunting scam joins two men in an uneasy alliance against a third in a race to find a fortune in gold buried in a remote cemetery.,1967-12-29,161,They formed an alliance of hate to steal a fortune in dead man's gold.,Luciano Vincenzoni
446,8.1,tt0107207,In the Name of the Father,1993,Daniel Day-Lewis,Pete Postlethwaite,Alison Crosbie,Philip King,Jim Sheridan,Biography,Drama,A man's coerced confession to an IRA bombing he did not commit results in the imprisonment of his father as well. An English lawyer fights to free them.,1994-02-25,133,Falsely accused.  Wrongly imprisoned.  He fought for justice to clear his father's name.,Gerry Conlon
447,7.9,tt2446600,Next Goal Wins,2014,Thomas Rongen,Jaiyah Saelua,Nicky Salapu,Gene Ne'emia,Mike Brett,Documentary,Sport,"The power of hope in the face of seemingly insurmountable odds, and an object lesson in what it really means to be a winner in life.",2014-05-09,97,,
448,8.8,tt0137523,Fight Club,1999,Brad Pitt,Edward Norton,Meat Loaf,Zach Grenier,David Fincher,Drama,nan,"An insomniac office worker, looking for a way to change his life, crosses paths with a devil-may-care soap maker, forming an underground fight club that evolves into something much, much more.",1999-10-15,139,How much can you know about yourself if you've never been in a fight?,Chuck Palahniuk
449,7.0,tt1259521,The Cabin in the Woods,2012,Kristen Connolly,Chris Hemsworth,Anna Hutchison,Fran Kranz,Drew Goddard,Horror,Mystery,"Five friends go for a break at a remote cabin in the woods, where they get more than they bargained for. Together, they must discover the truth behind the cabin in the woods.",2012-04-13,95,If you hear a strange sound outside... have sex.,Joss Whedon
450,7.8,tt0096874,Back to the Future Part II,1989,Michael J. Fox,Christopher Lloyd,Lea Thompson,Thomas F. Wilson,Robert Zemeckis,Adventure,Comedy,"After visiting 2015, Marty McFly must repeat his visit to 1955 to prevent disastrous changes to 1985...without interfering with his first trip.",1989-11-22,108,Getting back was only the beginning.,Robert Zemeckis
451,8.2,tt0070510,Paper Moon,1973,Ryan O'Neal,Tatum O'Neal,Madeline Kahn,John Hillerman,Peter Bogdanovich,Comedy,Crime,"During the Great Depression, a con man finds himself saddled with a young girl who may or may not be his daughter, and the two forge an unlikely partnership.",1973-05-09,102,These aren't everyday people and this is no ordinary movie.,Joe David Brown
452,8.0,tt0070047,The Exorcist,1973,Ellen Burstyn,Max von Sydow,Linda Blair,Lee J. Cobb,William Friedkin,Horror,nan,"When a teenage girl is possessed by a mysterious entity, her mother seeks the help of two priests to save her daughter.",1973-12-26,122,The movie you've been waiting for...without the wait.,William Peter Blatty
453,7.6,tt0112818,Dead Man Walking,1995,Susan Sarandon,Sean Penn,Robert Prosky,Raymond J. Barry,Tim Robbins,Crime,Drama,"A nun, while comforting a convicted killer on death row, empathizes with both the killer and his victim's families.",1996-02-02,122,,Helen Prejean
454,6.8,tt0112819,Dead Presidents,1995,Larenz Tate,Keith David,Chris Tucker,Freddy Rodríguez,Albert Hughes,Action,Crime,"A Vietnam vet adjusts to life after the war while trying to support his family, but the chance of a better life may involve crime and bloodshed.",1995-10-06,119,"In this daring heist, the only color that counts is green",Allen Hughes
455,8.9,tt0110912,Pulp Fiction,1994,John Travolta,Uma Thurman,Samuel L. Jackson,Bruce Willis,Quentin Tarantino,Crime,Drama,"The lives of two mob hit men, a boxer, a gangster's wife, and a pair of diner bandits intertwine in four tales of violence and redemption.",1994-10-14,154,Girls like me don't make invitations like this to just anyone!,Quentin Tarantino
456,7.7,tt1242422,Cell 211,2009,Luis Tosar,Alberto Ammann,Antonio Resines,Manuel Morón,Daniel Monzón,Action,Drama,"The story of two men on different sides of a prison riot -- the inmate leading the rebellion and the young guard trapped in the revolt, who poses as a prisoner in a desperate attempt to survive the ordeal.",2009-11-06,113,,Jorge Guerricaechevarría
457,7.2,tt0302886,Old School,2003,Luke Wilson,Vince Vaughn,Will Ferrell,Jeremy Piven,Todd Phillips,Comedy,nan,Three friends attempt to recapture their glory days by opening up a fraternity near their alma mater.,2003-02-21,88,"Critics say, ""'Old School' is dumb and pointless."" We say, ""WHO CARES?""",Court Crandall
458,7.2,tt2820852,Furious 7,2015,Vin Diesel,Paul Walker,Dwayne Johnson,Jason Statham,James Wan,Action,Crime,Deckard Shaw seeks revenge against Dominic Toretto and his family for his comatose brother.,2015-04-03,137,Vengeance hits home,Chris Morgan
459,8.2,tt0118715,The Big Lebowski,1998,Jeff Bridges,John Goodman,Julianne Moore,Steve Buscemi,Joel Coen,Comedy,Crime,"""The Dude"" Lebowski, mistaken for a millionaire Lebowski, seeks restitution for his ruined rug and enlists his bowling buddies to help get it.",1998-03-06,117,"They figured he was a lazy, time-wasting slacker. They were right.",Ethan Coen
460,8.1,tt0052311,Touch of Evil,1958,Charlton Heston,Orson Welles,Janet Leigh,Joseph Calleia,Orson Welles,Crime,Drama,"A stark, perverse story of murder, kidnapping, and police corruption in a Mexican border town.",1958-05-21,108,The Overwhelming Drama of a Strange Vengeance,Orson Welles
461,7.1,tt0113987,Nixon,1995,Anthony Hopkins,Joan Allen,Powers Boothe,Ed Harris,Oliver Stone,Biography,Drama,"A biographical story of former U.S. president Richard Milhous Nixon, from his days as a young boy to his eventual presidency which ended in shame.",1996-01-05,212,He changed a world. But lost a nation.,Stephen J. Rivele
462,8.1,tt0469494,There Will Be Blood,2007,Daniel Day-Lewis,Paul Dano,Ciarán Hinds,Martin Stringer,Paul Thomas Anderson,Drama,nan,"A story of family, religion, hatred, oil and madness, focusing on a turn-of-the-century prospector in the early days of the business.",2008-01-25,158,There Will Be Greed. There Will Be Vengeance.,Paul Thomas Anderson
463,7.3,tt0292963,Before the Devil Knows You're Dead,2007,Philip Seymour Hoffman,Ethan Hawke,Albert Finney,Marisa Tomei,Sidney Lumet,Crime,Drama,"When two brothers organize the robbery of their parents' jewelry store the job goes horribly wrong, triggering a series of events that sends them, their father and one brother's wife hurtling towards a shattering climax.",2007-10-26,117,No one was supposed to get hurt.,Kelly Masterson
464,8.0,tt0059742,The Sound of Music,1965,Julie Andrews,Christopher Plummer,Eleanor Parker,Richard Haydn,Robert Wise,Biography,Drama,A woman leaves an Austrian convent to become a governess to the children of a Naval officer widower.,1965-03-29,174,RADIANCE THAT FLOODS THE SCREEN...AND WARMS THE HEART!,George Hurdalek
465,8.0,tt0454876,Life of Pi,2012,Suraj Sharma,Irrfan Khan,Adil Hussain,Tabu,Ang Lee,Adventure,Drama,"A young man who survives a disaster at sea is hurtled into an epic journey of adventure and discovery. While cast away, he forms an unexpected connection with another survivor: a fearsome Bengal tiger.",2012-11-21,127,,Yann Martel
466,8.8,tt0109830,Forrest Gump,1994,Tom Hanks,Robin Wright,Gary Sinise,Sally Field,Robert Zemeckis,Comedy,Drama,"Forrest Gump, while not intelligent, has accidentally been present at many historic moments, but his true love, Jenny Curran, eludes him.",1994-07-06,142,The story of a lifetime.,Winston Groom
467,7.1,tt0109831,Four Weddings and a Funeral,1994,Hugh Grant,Andie MacDowell,James Fleet,Simon Callow,Mike Newell,Comedy,Drama,"Over the course of five social occasions, a committed bachelor must consider the notion that he may have discovered love.",1994-04-15,117,He's quite engaging. She's otherwise engaged.,Richard Curtis
468,8.0,tt0054997,The Hustler,1961,Paul Newman,Jackie Gleason,Piper Laurie,George C. Scott,Robert Rossen,Drama,Sport,An up-and-coming pool player plays a long-time champion in a single high-stakes match.,1961-10-27,134,"They Called Him ""Fast Eddie""",Sidney Carroll
469,7.9,tt1170358,The Hobbit: The Desolation of Smaug,2013,Ian McKellen,Martin Freeman,Richard Armitage,Ken Stott,Peter Jackson,Adventure,Fantasy,"The dwarves, along with Bilbo Baggins and Gandalf the Grey, continue their quest to reclaim Erebor, their homeland, from Smaug. Bilbo Baggins is in possession of a mysterious and magical ring.",2013-12-13,161,Beyond darkness... beyond desolation... lies the greatest danger of all.,Fran Walsh
470,6.6,tt1127180,Drag Me to Hell,2009,Alison Lohman,Justin Long,Ruth Livier,Lorna Raver,Sam Raimi,Comedy,Horror,"A loan officer who evicts an old woman from her home finds herself the recipient of a supernatural curse. Desperate, she turns to a seer to try and save her soul, while evil forces work to push her to a breaking point.",2009-05-29,99,"Christine Brown has a good job, a great boyfriend, and a bright future. But in three days, she's going to hell.",Sam Raimi
471,7.3,tt0145487,Spider-Man,2002,Tobey Maguire,Kirsten Dunst,Willem Dafoe,James Franco,Sam Raimi,Action,Adventure,"When bitten by a genetically modified spider, a nerdy, shy, and awkward high school student gains spider-like abilities that he eventually must use to fight evil as a superhero after tragedy befalls his family.",2002-05-03,121,With great power comes great responsibility.,Stan Lee
472,7.6,tt0427944,Thank You for Smoking,2005,Aaron Eckhart,Cameron Bright,Maria Bello,Joan Lunden,Jason Reitman,Comedy,Drama,"Satirical comedy follows the machinations of Big Tobacco's chief spokesman, Nick Naylor, who spins on behalf of cigarettes while trying to remain a role model for his twelve-year-old son.",2006-04-14,92,America is living in spin,Jason Reitman
473,7.4,tt1229238,Mission: Impossible - Ghost Protocol,2011,Tom Cruise,Jeremy Renner,Simon Pegg,Paula Patton,Brad Bird,Action,Adventure,"The IMF is shut down when it's implicated in the bombing of the Kremlin, causing Ethan Hunt and his new team to go rogue to clear their organization's name.",2011-12-21,133,No Plan. No Backup. No Choice.,Bruce Geller
474,7.6,tt0840361,The Town,2010,Ben Affleck,Rebecca Hall,Jon Hamm,Jeremy Renner,Ben Affleck,Crime,Drama,"As he plans his next job, a longtime thief tries to balance his feelings for a bank manager connected to one of his earlier heists, as well as the FBI agent looking to bring him and his crew down.",2010-09-17,125,Welcome to the bank robbery capital of America.,Peter Craig
475,7.9,tt2872718,Nightcrawler,2014,Jake Gyllenhaal,Rene Russo,Bill Paxton,Riz Ahmed,Dan Gilroy,Crime,Drama,"When Louis Bloom, a driven man desperate for work, muscles into the world of L.A. crime journalism, he blurs the line between observer and participant to become the star of his own story. Aiding him in his effort is Nina, a TV-news veteran.",2014-10-31,117,The City Shines Brightest at Night,Dan Gilroy
476,7.5,tt0464141,The Orphanage,2007,Belén Rueda,Fernando Cayo,Roger Príncep,Mabel Rivera,J.A. Bayona,Drama,Mystery,"A woman brings her family back to her childhood home, which used to be an orphanage for handicapped children. Before long, her son starts to communicate with an invisible new friend.",2008-01-11,105,Un cuento de amor. Una historia de terror (A tale of love. A story of horror),Sergio G. Sánchez
477,7.7,tt0096438,Who Framed Roger Rabbit,1988,Bob Hoskins,Christopher Lloyd,Joanna Cassidy,Charles Fleischer,Robert Zemeckis,Animation,Adventure,A toon-hating detective is a cartoon rabbit's only hope to prove his innocence when he is accused of murder.,1988-06-22,104,"It's the story of a man, a woman, and a rabbit in a triangle of trouble.",Gary K. Wolf
478,7.5,tt0098213,Roger & Me,1989,Michael Moore,Roger B. Smith,Rhonda Britton,Fred Ross,Michael Moore,Documentary,nan,"Director Michael Moore pursues GM CEO Roger Smith to confront him about the harm he did to Flint, Michigan with his massive downsizing.",1989-12-20,91,The story of a rebel and his mike.,Michael Moore
479,7.7,tt0108122,Short Cuts,1993,Andie MacDowell,Julianne Moore,Tim Robbins,Bruce Davison,Robert Altman,Comedy,Drama,The day-to-day lives of a number of suburban Los Angeles residents.,1993-10-01,187,Short Cuts raises the roof on America,Raymond Carver
480,7.9,tt0140352,The Insider,1999,Russell Crowe,Al Pacino,Christopher Plummer,Diane Venora,Michael Mann,Biography,Drama,"A research chemist comes under personal and professional attack when he decides to appear in a ""60 Minutes"" expose on Big Tobacco.",1999-11-05,157,Warning: Exposing the Truth May Be Hazardous,Marie Brenner
481,8.1,tt0120382,The Truman Show,1998,Jim Carrey,Ed Harris,Laura Linney,Noah Emmerich,Peter Weir,Comedy,Drama,An insurance salesman/adjuster discovers his entire life is actually a television show.,1998-06-05,103,All the world's a stage...,Andrew Niccol
482,7.0,tt1019452,A Serious Man,2009,Michael Stuhlbarg,Richard Kind,Sari Lennick,Fred Melamed,Ethan Coen,Comedy,Drama,"Larry Gopnik, a Midwestern physics teacher, watches his life unravel over multiple sudden incidents. Though seeking meaning and answers amidst his turmoils, he seems to keep sinking.",2009-11-06,106,,Joel Coen
483,7.8,tt0780504,Drive,2011,Ryan Gosling,Carey Mulligan,Bryan Cranston,Albert Brooks,Nicolas Winding Refn,Crime,Drama,A mysterious Hollywood stuntman and mechanic moonlights as a getaway driver and finds himself in trouble when he helps out his neighbor.,2011-09-16,100,Some Heroes Are Real,Hossein Amini
484,7.3,tt0110074,The Hudsucker Proxy,1994,Tim Robbins,Paul Newman,Jennifer Jason Leigh,Charles Durning,Joel Coen,Comedy,Fantasy,A naive business graduate is installed as president of a manufacturing company as part of a stock scam.,1994-03-11,111,A Comedy of Invention.,Ethan Coen
485,8.0,tt1157605,Anvil: The Story of Anvil,2008,Robb Reiner,Steve 'Lips' Kudlow,Tiziana Arrigoni,Scott Ian,Sacha Gervasi,Documentary,Biography,"Since 1978, Anvil has become one of heavy metal's most influential yet commercially unsuccessful acts. In 2006, after a fledging European tour Anvil sets out to record their thirteenth album and continue to follow their dreams.",2009-02-20,80,"At fourteen, they made a pact to rock together forever. They meant it.",nan
486,7.3,tt0097493,Heathers,1988,Winona Ryder,Christian Slater,Shannen Doherty,Lisanne Falk,Michael Lehmann,Comedy,Crime,"In order to get out of the snobby clique that is destroying her good-girl reputation, an intelligent teen teams up with a dark sociopath in a plot to kill the cool kids.",1989-03-31,103,"Best friends, social trends and occasional murder.",Daniel Waters
487,7.6,tt0268380,Ice Age,2002,Denis Leary,John Leguizamo,Ray Romano,Goran Visnjic,Chris Wedge,Animation,Adventure,"Set during the Ice Age, a sabertooth tiger, a sloth, and a wooly mammoth find a lost human infant, and they try to return him to his tribe.",2002-03-15,81,"The Coolest Event In 16,000 Years.",Michael J. Wilson
488,7.6,tt0103939,Chaplin,1992,Robert Downey Jr.,Geraldine Chaplin,Paul Rhys,John Thaw,Richard Attenborough,Biography,Comedy,A film about the troubled and controversial life of the master comedy filmmaker Charles Chaplin.,1993-01-08,143,He made the whole world laugh and cry. He will again.,David Robinson
489,8.0,tt0040746,Rope,1948,James Stewart,John Dall,Farley Granger,Edith Evanson,Alfred Hitchcock,Crime,Drama,"Two young men strangle their ""inferior"" classmate, hide his body in their apartment, and invite his friends and family to a dinner party as a means to challenge the ""perfection"" of their crime.",1948-08-28,80,The guest who's dead on time,Hume Cronyn
490,8.5,tt0110357,The Lion King,1994,Matthew Broderick,Jeremy Irons,James Earl Jones,Whoopi Goldberg,Roger Allers,Animation,Adventure,Lion cub and future king Simba searches for his identity. His eagerness to please others and penchant for testing his boundaries sometimes gets him into trouble.,1994-06-24,89,See it for the first time ever in 3D (2011 3D re-release),Irene Mecchi
491,7.8,tt1132620,The Girl with the Dragon Tattoo,2009,Michael Nyqvist,Noomi Rapace,Ewa Fröling,Lena Endre,Niels Arden Oplev,Crime,Drama,A journalist is aided in his search for a woman who has been missing -- or dead -- for forty years by a young female hacker.,2010-04-30,152,,Nikolaj Arcel
492,7.4,tt0462538,The Simpsons Movie,2007,Dan Castellaneta,Julie Kavner,Nancy Cartwright,Yeardley Smith,David Silverman,Animation,Adventure,"After Homer accidentally pollutes the town's water supply, Springfield is encased in a gigantic dome by the EPA and the Simpson family are declared fugitives.",2007-07-27,87,See our family. And feel better about yours.,James L. Brooks
493,7.3,tt0093105,"Good Morning, Vietnam",1987,Robin Williams,Forest Whitaker,Tung Thanh Tran,Chintara Sukapatana,Barry Levinson,Biography,Comedy,An unorthodox and irreverent DJ begins to shake up things when he is assigned to the U.S. Armed Services Radio station in Vietnam.,1988-01-15,121,Time to rock it from the Delta to the DMZ!,Mitch Markowitz
494,8.7,tt0047478,Seven Samurai,1954,Toshirô Mifune,Takashi Shimura,Keiko Tsushima,Yukiko Shimazaki,Akira Kurosawa,Action,Adventure,A poor village under attack by bandits recruits seven unemployed samurai to help them defend themselves.,1956-11-19,158,Will Take Its Place With the Seven Greatest Films of All Time!,Akira Kurosawa
495,7.7,tt1285016,The Social Network,2010,Jesse Eisenberg,Andrew Garfield,Justin Timberlake,Rooney Mara,David Fincher,Biography,Drama,"Harvard student Mark Zuckerberg creates the social networking site that would become known as Facebook, but is later sued by two brothers who claimed he stole their idea, and the co-founder who was later squeezed out of the business.",2010-10-01,120,You don't get to 500 million friends without making a few enemies,Aaron Sorkin
496,8.0,tt0118147,When We Were Kings,1996,Muhammad Ali,George Foreman,Don King,James Brown,Leon Gast,Documentary,Sport,"A documentary of the 1974 heavyweight championship bout in Zaire, ""The Rumble in the Jungle,"" between champion George Foreman and underdog challenger Muhammad Ali.",1997-02-14,88,The untold story of the Rumble in the Jungle,nan
497,8.0,tt0287467,Talk to Her,2002,Rosario Flores,Javier Cámara,Darío Grandinetti,Leonor Watling,Pedro Almodóvar,Drama,Mystery,Two men share an odd friendship while they care for two women who are both in deep comas.,2003-02-14,112,,Pedro Almodóvar
498,7.2,tt0217869,Unbreakable,2000,Bruce Willis,Samuel L. Jackson,Robin Wright,Spencer Treat Clark,M. Night Shyamalan,Drama,Mystery,A man learns something extraordinary about himself after a devastating accident.,2000-11-22,106,Shattering cinemas soon.,M. Night Shyamalan
499,7.1,tt0099423,Die Hard 2,1990,Bruce Willis,William Atherton,Bonnie Bedelia,Reginald VelJohnson,Renny Harlin,Action,Thriller,"John McClane attempts to avert disaster as rogue military operatives seize control of Dulles International Airport in Washington, D.C.",1990-07-04,124,Die Harder.,Walter Wager
500,8.0,tt0365748,Shaun of the Dead,2004,Simon Pegg,Nick Frost,Kate Ashfield,Lucy Davis,Edgar Wright,Comedy,Horror,"A man decides to turn his moribund life around by winning back his ex-girlfriend, reconciling his relationship with his mother, and dealing with an entire community that has returned from the dead to eat the living.",2004-09-24,99,It's just one of those days when you're feeling a little...dead.,Simon Pegg
501,7.9,tt0104684,Hard Boiled,1992,Yun-Fat Chow,Tony Chiu Wai Leung,Teresa Mo,Philip Chan,John Woo,Action,Crime,A tough-as-nails cop teams up with an undercover agent to shut down a sinister mobster and his crew.,1992-04-16,128,"As a cop, he has brains, brawn, and an instinct to kill.",John Woo
502,8.0,tt0063350,Night of the Living Dead,1968,Duane Jones,Judith O'Dea,Karl Hardman,Marilyn Eastman,George A. Romero,Drama,Horror,There is panic throughout the nation as the dead suddenly come back to life. The film follows a group of characters who barricade themselves in an old farmhouse in an attempt to remain safe from these flesh eating monsters.,1968-10-31,96,"If it doesn't scare you, you're already dead!",John A. Russo
503,6.8,tt1456635,Goon,2011,Seann William Scott,Jay Baruchel,Alison Pill,Eugene Levy,Michael Dowse,Comedy,Sport,"Labeled an outcast by his brainy family, a bouncer overcomes long odds to lead a team of under performing misfits to semi-pro hockey glory, beating the crap out of everything that stands in his way.",2012-01-06,92,"Meet Doug, The Nicest Guy You'll Ever Fight.",Jay Baruchel
504,7.7,tt1024648,Argo,2012,Ben Affleck,Bryan Cranston,John Goodman,Alan Arkin,Ben Affleck,Biography,Drama,"Acting under the cover of a Hollywood producer scouting a location for a science fiction film, a CIA agent launches a dangerous operation to rescue six Americans in Tehran during the U.S. hostage crisis in Iran in 1980.",2012-10-12,120,The movie was fake. The mission was real.,Chris Terrio
505,7.3,tt0116695,Jerry Maguire,1996,Tom Cruise,Cuba Gooding Jr.,Renée Zellweger,Kelly Preston,Cameron Crowe,Comedy,Drama,"When a sports agent has a moral epiphany and is fired for expressing it, he decides to put his new philosophy to the test as an independent with the only athlete who stays with him.",1996-12-13,139,You had me at hello.,Cameron Crowe
506,7.6,tt0083907,The Evil Dead,1981,Bruce Campbell,Ellen Sandweiss,Richard DeManincor,Betsy Baker,Sam Raimi,Horror,Thriller,"Five friends travel to a cabin in the woods, where they unknowingly release flesh-possessing demons.",1983-04-15,85,They got up on the wrong side of the grave.,Sam Raimi
507,7.0,tt1740707,Trollhunter,2010,Otto Jespersen,Robert Stoltenberg,Knut Nærum,Glenn Erland Tosterud,André Øvredal,Drama,Fantasy,"A group of students investigates a series of mysterious bear killings, but learns that there are much more dangerous things going on. They start to follow a mysterious hunter, learning that he is actually a troll hunter.",2010-10-29,103,You'll believe it when you see it!,André Øvredal
508,7.1,tt1124035,The Ides of March,2011,Paul Giamatti,George Clooney,Philip Seymour Hoffman,Ryan Gosling,George Clooney,Drama,nan,An idealistic staffer for a new presidential candidate gets a crash course on dirty politics during his stint on the campaign trail.,2011-10-07,101,Ambition seduces. Power corrupts.,George Clooney
509,8.0,tt0032599,His Girl Friday,1940,Cary Grant,Rosalind Russell,Ralph Bellamy,Gene Lockhart,Howard Hawks,Comedy,Drama,A newspaper editor uses every trick in the book to keep his ace reporter ex-wife from remarrying.,1940-01-18,92,She learned about men from him!,Charles Lederer
510,7.6,tt0116922,Lost Highway,1997,Bill Pullman,Patricia Arquette,John Roselius,Louis Eppolito,David Lynch,Mystery,Thriller,"After a bizarre encounter at a party, a jazz saxophonist is framed for the murder of his wife and sent to prison, where he inexplicably morphs into a young mechanic and begins leading a new life.",1997-02-21,134,,David Lynch
511,6.5,tt0409904,Day Watch,2006,Konstantin Khabenskiy,Mariya Poroshina,Vladimir Menshov,Galina Tyunina,Timur Bekmambetov,Action,Fantasy,"A man who serves in the war between the forces of Light and Dark comes into possession of a device that can restore life to Moscow, which was nearly destroyed by an apocalyptic event.",2007-06-15,146,First film of the year,Timur Bekmambetov
512,7.6,tt3416742,What We Do in the Shadows,2014,Jemaine Clement,Taika Waititi,Cori Gonzalez-Macuer,Jonny Brugh,Jemaine Clement,Comedy,Fantasy,"A documentary team films the lives of a group of vampires for a few months. The vampires share a house in Wellington, New Zealand. Turns out vampires have their own domestic problems too.",2015-02-13,86,,Taika Waititi
513,7.8,tt0421715,The Curious Case of Benjamin Button,2008,Brad Pitt,Cate Blanchett,Tilda Swinton,Julia Ormond,David Fincher,Drama,Fantasy,"Tells the story of Benjamin Button, a man who starts aging backwards with bizarre consequences.",2008-12-25,166,"Life isn't measured in minutes, but in moments",Eric Roth
514,8.0,tt0053221,Rio Bravo,1959,John Wayne,Dean Martin,Ricky Nelson,Angie Dickinson,Howard Hawks,Action,Drama,"A small-town sheriff in the American West enlists the help of a cripple, a drunk, and a young gunfighter in his efforts to hold in jail the brother of the local bad guy.",1959-04-04,141,...and the girl they all call 'Feathers',Jules Furthman
515,7.9,tt0088847,The Breakfast Club,1985,Emilio Estevez,Judd Nelson,Molly Ringwald,Ally Sheedy,John Hughes,Comedy,Drama,"Five high school students, all different stereotypes, meet in detention, where they pour their hearts out to each other, and discover how they have a lot more in common than they thought.",1985-02-15,97,"They only met once, but it changed their lives forever.",John Hughes
