,rating,tconst,title,year,cast1,cast2,cast3,cast4,director,genre1,genre2,plot,date,runtime,tagline,writers
217,8.1,tt0083987,Gandhi,1982,Ben Kingsley,John Gielgud,Candice Bergen,Edward Fox,Richard Attenborough,Biography,Drama,"Gandhi's character is fully explained as a man of nonviolence. Through his patience, he is able to drive the British out of the subcontinent. And the stubborn nature of Jinnah and his commitment towards Pakistan is portrayed.",1983-02-25,191,His Triumph Changed The World Forever.,John Briley
218,8.1,tt0440963,The Bourne Ultimatum,2007,Matt Damon,Edgar Ramírez,Joan Allen,Julia Stiles,Paul Greengrass,Action,Mystery,Jason Bourne dodges a ruthless CIA official and his agents from a new assassination program while searching for the origins of his life as a trained killer.,2007-08-03,115,This Summer Jason Bourne Comes Home,Tony Gilroy
219,8.1,tt0046911,Diabolique,1955,Simone Signoret,Véra Clouzot,Paul Meurisse,Charles Vanel,Henri-Georges Clouzot,Crime,Drama,"The wife of a cruel headmaster and his mistress conspire to kill him, but after the murder is committed, his body disappears, and strange events begin to plague the two women.",1955-11-21,116,"See it, be amazed at it, but... BE QUIET ABOUT IT! (original Finnish poster tagline)",Pierre Boileau
220,8.1,tt0075148,Rocky,1976,Sylvester Stallone,Talia Shire,Burt Young,Carl Weathers,John G. Avildsen,Drama,Sport,"Rocky Balboa, a small-time boxer, gets a supremely rare chance to fight heavy-weight champion Apollo Creed in a bout in which he strives to go the distance for his self-respect.",1976-12-03,120,You have a ringside seat for the bloodiest bicentennial in history!,Sylvester Stallone
221,8.1,tt0246578,Donnie Darko,2001,Jake Gyllenhaal,Jena Malone,Mary McDonnell,Holmes Osborne,Richard Kelly,Drama,Sci-Fi,"A troubled teenager is plagued by visions of a man in a large rabbit suit who manipulates him to commit a series of crimes, after he narrowly escapes a bizarre accident.",2001-10-26,113,Life is one long insane trip. Some people just have better directions.,Richard Kelly
222,8.1,tt1201607,Harry Potter and the Deathly Hallows: Part 2,2011,Daniel Radcliffe,Emma Watson,Rupert Grint,Michael Gambon,David Yates,Adventure,Drama,"Harry, Ron and Hermione search for Voldemort's remaining Horcruxes in their effort to destroy the Dark Lord as the final battle rages on at Hogwarts.",2011-07-15,130,It All Ends Here,Steve Kloves
223,8.1,tt0056801,8½,1963,Marcello Mastroianni,Anouk Aimée,Claudia Cardinale,Sandra Milo,Federico Fellini,Drama,Fantasy,A harried movie director retreats into his memories and fantasies.,1963-06-25,138,A picture that goes beyond what men think about - because no man ever thought about it in quite this way!,Federico Fellini
224,8.1,tt0198781,"Monsters, Inc.",2001,Billy Crystal,John Goodman,Mary Gibbs,Steve Buscemi,Pete Docter,Animation,Adventure,"In order to power the city, monsters have to scare children so that they scream. However, the children are toxic to the monsters, and after a child gets through, two monsters realize things may not be what they think.",2001-11-02,92,"Monsters, Inc. : We Scare Because We Care",Pete Docter
225,8.1,tt0032138,The Wizard of Oz,1939,Judy Garland,Frank Morgan,Ray Bolger,Bert Lahr,Victor Fleming,Adventure,Family,Dorothy Gale is swept away to a magical land in a tornado and embarks on a quest to see the Wizard who can help her return home.,1939-08-25,102,Mighty Miracle Show Of 1000 Delights !,Noel Langley
226,8.0,tt0088247,The Terminator,1984,Arnold Schwarzenegger,Linda Hamilton,Michael Biehn,Paul Winfield,James Cameron,Action,Sci-Fi,"A seemingly indestructible humanoid cyborg is sent from 2029 to 1984 to assassinate a waitress, whose unborn son will lead humanity in a war against the machines, while a soldier from that war is sent to protect her at all costs.",1984-10-26,107,"La sua missione e una sola: distruggere, uccidere... (Its mission and only one: to destroy, to kill...) (Italian DVD)",James Cameron
227,8.1,tt0107048,Groundhog Day,1993,Bill Murray,Andie MacDowell,Chris Elliott,Stephen Tobolowsky,Harold Ramis,Comedy,Fantasy,A weatherman finds himself living the same day over and over again.,1993-02-12,101,"He's having the worst day of his life... over, and over...",Danny Rubin
228,8.0,tt0114746,Twelve Monkeys,1995,Bruce Willis,Madeleine Stowe,Brad Pitt,Joseph Melito,Terry Gilliam,Mystery,Sci-Fi,"In a future world devastated by disease, a convict is sent back in time to gather information about the man-made virus that wiped out most of the human population on the planet.",1996-01-05,129,The future is history.,Chris Marker
229,8.1,tt1392214,Prisoners,2013,Hugh Jackman,Jake Gyllenhaal,Viola Davis,Melissa Leo,Denis Villeneuve,Crime,Drama,"When Keller Dover's daughter and her friend go missing, he takes matters into his own hands as the police pursue multiple leads and the pressure mounts. But just how far will this desperate father go to protect his family?",2013-09-20,153,Every moment matters,Aaron Guzikowski
230,8.0,tt0073195,Jaws,1975,Roy Scheider,Robert Shaw,Richard Dreyfuss,Lorraine Gary,Steven Spielberg,Adventure,Drama,"When a gigantic great white shark begins to menace the small island community of Amity, a police chief, a marine scientist and a grizzled fisherman set out to stop it.",1975-06-20,124,Amity Island had everything. Clear skies. Gentle surf. Warm water. People flocked there every summer. It was the perfect feeding ground.,Peter Benchley
231,8.1,tt0072684,Barry Lyndon,1975,Ryan O'Neal,Marisa Berenson,Patrick Magee,Hardy Krüger,Stanley Kubrick,Adventure,Drama,An Irish rogue wins the heart of a rich widow and assumes her dead husband's aristocratic position in 18th-century England.,1975-12-18,184,At long last Redmond Barry became a gentleman -- and that was his tragedy.,Stanley Kubrick
232,8.1,tt0338564,Infernal Affairs,2002,Andy Lau,Tony Chiu Wai Leung,Anthony Chau-Sang Wong,Eric Tsang,Wai-Keung Lau,Crime,Drama,"A story between a mole in the police department and an undercover cop. Their objectives are the same: to find out who is the mole, and who is the cop.",2002-12-12,101,Loyalty. Honor. Betrayal.,Alan Mak
233,8.0,tt0264464,Catch Me If You Can,2002,Leonardo DiCaprio,Tom Hanks,Christopher Walken,Martin Sheen,Steven Spielberg,Biography,Crime,"The true story of Frank Abagnale Jr. who, before his 19th birthday, successfully conned millions of dollars' worth of checks as a Pan Am pilot, doctor, and legal prosecutor.",2002-12-25,141,The true story of a real fake.,Jeff Nathanson
234,8.1,tt0113247,La Haine,1995,Vincent Cassel,Hubert Koundé,Saïd Taghmaoui,Abdel Ahmed Ghili,Mathieu Kassovitz,Crime,Drama,24 hours in the lives of three young men in the French suburbs the day after a violent riot.,1996-02-23,98,"So far, so good",Mathieu Kassovitz
235,8.1,tt0036868,The Best Years of Our Lives,1946,Fredric March,Dana Andrews,Myrna Loy,Teresa Wright,William Wyler,Drama,Romance,Three World War II veterans return home to small-town America to discover that they and their families have been irreparably changed.,1947-06-17,172,THE SCREEN'S GREATEST LOVE STORY IS THE BEST FILM THIS YEAR FROM HOLLYWOOD!,Robert E. Sherwood
236,8.1,tt0044079,Strangers on a Train,1951,Farley Granger,Robert Walker,Ruth Roman,Leo G. Carroll,Alfred Hitchcock,Crime,Film-Noir,A psychotic socialite confronts a pro tennis star with a theory on how two complete strangers can get away with murder - a theory that he plans to implement.,1951-06-30,101,Now a very special Alfred Hitchcock event! A hundred and one breathless minutes of matchless suspense!,Raymond Chandler
237,8.0,tt0401792,Sin City,2005,Mickey Rourke,Clive Owen,Bruce Willis,Jessica Alba,Frank Miller,Crime,Thriller,"A film that explores the dark and miserable town, Basin City, and tells the story of three different people, all caught up in violent corruption.",2005-04-01,147,Hell of a way to end a partnership.,Frank Miller
238,8.1,tt0058946,The Battle of Algiers,1966,Brahim Hadjadj,Jean Martin,Yacef Saadi,Samia Kerbash,Gillo Pontecorvo,Drama,History,"In the 1950s, fear and violence escalate as the people of Algiers fight for independence from the French government.",1967-09-20,121,The French Colonel...who was forced even to torture! One of the many women...who stopped at nothing to win! The Algerian Street Boy...who became a rebel hero!,Franco Solinas
239,8.0,tt0072890,Dog Day Afternoon,1975,Al Pacino,John Cazale,Penelope Allen,Sully Boyar,Sidney Lumet,Crime,Drama,A man robs a bank to pay for his lover's operation; it turns into a hostage situation and a media circus.,1975-09-21,125,"The robbery should have taken 10 minutes. 4 hours later, the bank was like a circus sideshow. 8 hours later, it was the hottest thing on live T.V. 12 hours later, it was all history. And it's all true",Frank Pierson
240,8.1,tt0041546,Kind Hearts and Coronets,1949,Dennis Price,Alec Guinness,Valerie Hobson,Joan Greenwood,Robert Hamer,Comedy,Crime,A distant poor relative of the Duke of D'Ascoyne plots to inherit the title by murdering the eight other heirs who stand ahead of him in the line of succession.,1950-06-14,106,He chopped down the family tree...,Roy Horniman
241,8.1,tt0325980,Pirates of the Caribbean: The Curse of the Black Pearl,2003,Johnny Depp,Geoffrey Rush,Orlando Bloom,Keira Knightley,Gore Verbinski,Action,Adventure,"Blacksmith Will Turner teams up with eccentric pirate ""Captain"" Jack Sparrow to save his love, the governor's daughter, from Jack's former pirate allies, who are now undead.",2003-07-09,143,Prepare to be blown out of the water.,Ted Elliott
242,8.1,tt1454029,The Help,2011,Emma Stone,Viola Davis,Octavia Spencer,Bryce Dallas Howard,Tate Taylor,Drama,nan,"An aspiring author during the civil rights movement of the 1960s decides to write a book detailing the African American maids' point of view on the white families for which they work, and the hardships they go through on a daily basis.",2011-08-10,146,Change begins with a whisper.,Tate Taylor
243,8.3,tt1954470,Gangs of Wasseypur,2012,Manoj Bajpayee,Richa Chadha,Nawazuddin Siddiqui,Tigmanshu Dhulia,Anurag Kashyap,Action,Crime,"A clash between Sultan and Shahid Khan leads to the expulsion of Khan from Wasseypur, and ignites a deadly blood feud spanning three generations.",2012-08-02,320,,Anurag Kashyap
244,8.1,tt2084970,The Imitation Game,2014,Benedict Cumberbatch,Keira Knightley,Matthew Goode,Allen Leech,Morten Tyldum,Biography,Drama,"During World War II, mathematician Alan Turing tries to crack the enigma code with help from fellow mathematicians.",2014-12-25,114,The true enigma was the man who cracked the code,Graham Moore
245,8.2,tt1865505,Song of the Sea,2014,David Rawle,Brendan Gleeson,Lisa Hannigan,Fionnula Flanagan,Tomm Moore,Animation,Adventure,"Ben, a young Irish boy, and his little sister Saoirse, a girl who can turn into a seal, go on an adventure to free the faeries and save the spirit world.",2014-12-10,93,,Tomm Moore
246,8.1,tt1220719,Ip Man,2008,Donnie Yen,Simon Yam,Siu-Wong Fan,Ka Tung Lam,Wilson Yip,Action,Biography,"During the Japanese invasion of 1937, when a wealthy martial artist is forced to leave his home and work to support his family, he reluctantly agrees to train others in the art of Wing Chun for self-defense.",2008-12-12,106,The celebrated Kung Fu master of Bruce Lee,Edmond Wong
247,8.0,tt1663202,The Revenant,2015,Leonardo DiCaprio,Tom Hardy,Will Poulter,Domhnall Gleeson,Alejandro G. Iñárritu,Adventure,Drama,A frontiersman on a fur trading expedition in the 1820s fights for survival after being mauled by a bear and left for dead by members of his own hunting team.,2016-01-08,156,"(n. One who has returned, as if from the dead.)",Mark L. Smith
248,8.0,tt3659388,The Martian,2015,Matt Damon,Jessica Chastain,Kristen Wiig,Kate Mara,Ridley Scott,Adventure,Drama,"An astronaut becomes stranded on Mars after his team assume him dead, and must rely on his ingenuity to find a way to signal to Earth that he is alive.",2015-10-02,144,Bring Him Home,Drew Goddard
249,8.1,tt0092067,Castle in the Sky,1986,Anna Paquin,Keiko Yokozawa,Mayumi Tanaka,James Van Der Beek,Hayao Miyazaki,Animation,Adventure,A young boy and a girl with a magic crystal must race against pirates and foreign agents in a search for a legendary floating castle.,1986-08-02,125,,Hayao Miyazaki
