,rating,tconst,title,year,cast1,cast2,cast3,cast4,director,genre1,genre2,plot,date,runtime,tagline,writers
144,8.2,tt0120735,"Lock, Stock and Two Smoking Barrels",1998,Jason Flemyng,Dexter Fletcher,Nick Moran,Jason Statham,Guy Ritchie,Comedy,Crime,"A botched card game in London triggers four friends, thugs, weed-growers, hard gangsters, loan sharks and debt collectors to collide with each other in a series of unexpected events, all for the sake of weed, cash and two antique shotguns.",1998-08-28,107,A Disgrace to Criminals Everywhere.,Guy Ritchie
145,8.5,tt0073707,Sholay,1975,Dharmendra,Sanjeev Kumar,Hema Malini,Amitabh Bachchan,Ramesh Sippy,Action,Adventure,"After his family is murdered by a notorious and ruthless bandit, a former police officer enlists the services of two outlaws to capture him.",1975-08-15,162,The greatest star cast ever assembled.......The greatest story ever told,Javed Akhtar
146,8.4,tt0405508,Rang De Basanti,2006,Aamir Khan,Soha Ali Khan,Siddharth,Sharman Joshi,Rakeysh Omprakash Mehra,Comedy,Drama,"The story of six young Indians who assist an English Woman to film a documentary on the extremist freedom fighters from their past, and the events that lead them to relive the long forgotten saga of freedom.",2006-01-26,157,A Generation Awakens.,Kamlesh Pandey
147,8.2,tt0112641,Casino,1995,Robert De Niro,Sharon Stone,Joe Pesci,James Woods,Martin Scorsese,Biography,Crime,"Greed, deception, money, power, and murder occur between two best friends, a mafia underboss and a casino owner, for a trophy wife over a gambling empire.",1995-11-22,178,You don't stay at the top forever,Nicholas Pileggi
148,8.3,tt0055031,Judgment at Nuremberg,1961,Spencer Tracy,Burt Lancaster,Richard Widmark,Marlene Dietrich,Stanley Kramer,Drama,History,"In 1948, an American court in occupied Germany tries four Nazi judges for war crimes.",1961-12-18,186,More than a motion picture...It is an overwhelming experience in human emotion you will never forget!,Abby Mann
149,8.2,tt0050986,Wild Strawberries,1957,Victor Sjöström,Bibi Andersson,Ingrid Thulin,Gunnar Björnstrand,Ingmar Bergman,Drama,Romance,"After living a life marked by coldness, an aging professor is forced to confront the emptiness of his existence.",1959-06-22,91,"""We are such stuff as dreams are made on, and our little life is rounded with a sleep."" Shakespeare - The Tempest",Ingmar Bergman
150,8.2,tt0080678,The Elephant Man,1980,Anthony Hopkins,John Hurt,Anne Bancroft,John Gielgud,David Lynch,Biography,Drama,"A Victorian surgeon rescues a heavily disfigured man who is mistreated while scraping a living as a side-show freak. Behind his monstrous facade, there is revealed a person of intelligence and sensitivity.",1980-10-10,124,I am not an animal! I am a human being! I...am...a man!,Christopher De Vore
151,8.2,tt0017925,The General,1926,Buster Keaton,Marion Mack,Glen Cavender,Jim Farley,Clyde Bruckman,Action,Adventure,"When Union spies steal an engineer's beloved locomotive, he pursues it single-handedly and straight through enemy lines.",1927-02-24,75,"Buster drives ""The General"" to trainload of laughter. (Trade paper ad).",Buster Keaton
152,8.2,tt0268978,A Beautiful Mind,2001,Russell Crowe,Ed Harris,Jennifer Connelly,Christopher Plummer,Ron Howard,Biography,Drama,"After John Nash, a brilliant but asocial mathematician, accepts secret work in cryptography, his life takes a turn for the nightmarish.",2002-01-04,135,The Only Thing Greater Than the Power of the Mind is the Courage of the Heart,Akiva Goldsman
153,8.3,tt0019254,The Passion of Joan of Arc,1928,Maria Falconetti,Eugene Silvain,André Berley,Maurice Schutz,Carl Theodor Dreyer,Biography,Drama,"A chronicle of the trial of Jeanne d'Arc on charges of heresy, and the efforts of her ecclesiastical jurists to force Jeanne to recant her claims of holy visions.",1928-01-01,114,JOAN of ARC PICTURES Inc. presents,Carl Theodor Dreyer
154,8.2,tt1291584,Warrior,2011,Tom Hardy,Nick Nolte,Joel Edgerton,Jennifer Morrison,Gavin O'Connor,Drama,Sport,"The youngest son of an alcoholic former boxer returns home, where he's trained by his father for competition in a mixed martial arts tournament - a path that puts the fighter on a collision course with his estranged, older brother.",2011-09-09,140,Fight for Country,Gavin O'Connor
155,8.2,tt0993846,The Wolf of Wall Street,2013,Leonardo DiCaprio,Jonah Hill,Margot Robbie,Matthew McConaughey,Martin Scorsese,Biography,Comedy,"Based on the true story of Jordan Belfort, from his rise to a wealthy stock-broker living the high life to his fall involving crime, corruption and the federal government.",2013-12-25,180,,Terence Winter
156,8.2,tt1255953,Incendies,2010,Lubna Azabal,Mélissa Désormeaux-Poulin,Maxim Gaudette,Mustafa Kamel,Denis Villeneuve,Drama,Mystery,"Twins journey to the Middle East to discover their family history, and fulfill their mother's last wishes.",2011-01-12,139,The search began at the opening of their mother's will.,Denis Villeneuve
157,8.2,tt0434409,V for Vendetta,2005,Hugo Weaving,Natalie Portman,Rupert Graves,Stephen Rea,James McTeigue,Action,Drama,"In a future British tyranny, a shadowy freedom fighter, known only by the alias of ""V"", plots to overthrow it with the help of a young woman.",2006-03-17,132,"Remember, remember the 5th of November, the gun powder treason and plot. I know of no reason why the gun powder treason should ever be forgot.",Lilly Wachowski
158,8.3,tt0018455,Sunrise,1927,George O'Brien,Janet Gaynor,Margaret Livingston,Bodil Rosing,F.W. Murnau,Drama,Romance,"A married farmer falls under the spell of a slatternly woman from the city, who tries to convince him to drown his wife.",1927-11-04,94,,Carl Mayer
159,8.2,tt1205489,Gran Torino,2008,Clint Eastwood,Bee Vang,Christopher Carley,Ahney Her,Clint Eastwood,Drama,,"Disgruntled Korean War veteran Walt Kowalski sets out to reform his neighbor, a Hmong teenager who tried to steal Kowalski's prized possession: a 1972 Gran Torino.",2009-01-09,116,,Nick Schenk
160,8.2,tt0118715,The Big Lebowski,1998,Jeff Bridges,John Goodman,Julianne Moore,Steve Buscemi,Joel Coen,Comedy,Crime,"""The Dude"" Lebowski, mistaken for a millionaire Lebowski, seeks restitution for his ruined rug and enlists his bowling buddies to help get it.",1998-03-06,117,"They figured he was a lazy, time-wasting slacker. They were right.",Ethan Coen
161,8.3,tt0046438,Tokyo Story,1953,Chishû Ryû,Chieko Higashiyama,Sô Yamamura,Setsuko Hara,Yasujirô Ozu,Drama,,An old couple visit their children and grandchildren in the city; but the children have little time for them.,1972-03-13,136,,Kôgo Noda
162,8.2,tt0046912,Dial M for Murder,1954,Ray Milland,Grace Kelly,Robert Cummings,John Williams,Alfred Hitchcock,Crime,Thriller,"An ex-tennis pro carries out a plot to murder his wife. When things go wrong, he improvises a brilliant plan B.",1954-05-29,105,Kiss By Kiss...Supreme Suspense Unfurls!,Frederick Knott
163,8.2,tt0077416,The Deer Hunter,1978,Robert De Niro,Christopher Walken,John Cazale,John Savage,Michael Cimino,Drama,History,An in-depth examination of the ways in which the U.S. Vietnam War impacts and disrupts the lives of people in a small industrial town in Pennsylvania.,1979-02-23,183,One of the most important and powerful films of all time!,Michael Cimino
164,8.2,tt0117951,Trainspotting,1996,Ewan McGregor,Ewen Bremner,Jonny Lee Miller,Kevin McKidd,Danny Boyle,Drama,nan,"Renton, deeply immersed in the Edinburgh drug scene, tries to clean up and get out, despite the allure of the drugs and influence of friends.",1996-08-09,94,"Choose life. Choose a job. Choose a starter home. Choose dental insurance, leisure wear and matching luggage. Choose your future. But why would anyone want to do a thing like that?",John Hodge
165,8.2,tt0031381,Gone with the Wind,1939,Clark Gable,Vivien Leigh,Thomas Mitchell,Barbara O'Neil,Victor Fleming,Drama,History,A manipulative Southern belle carries on a turbulent affair with a blockade runner during the American Civil War.,1940-01-17,238,"For the thousands who remember its unparalleled drama, action and romance! For the new thousands to whom the wonders will be revealed for the first time! Breathtaking spectacle, inspired acting by the greatest cast ever assembled! The screen's most exciting love story! The most-talked about picture ever made! [reissue]",Margaret Mitchell
166,8.1,tt0116282,Fargo,1996,William H. Macy,Frances McDormand,Steve Buscemi,Peter Stormare,Joel Coen,Crime,Drama,Jerry Lundegaard's inept crime falls apart due to his and his henchmen's bungling and the persistent police work of the quite pregnant Marge Gunderson.,1996-04-05,98,A homespun murder story.,Ethan Coen
167,8.2,tt0266543,Finding Nemo,2003,Albert Brooks,Ellen DeGeneres,Alexander Gould,Willem Dafoe,Andrew Stanton,Animation,Adventure,"After his son is captured in the Great Barrier Reef and taken to Sydney, a timid clownfish sets out on a journey to bring him home.",2003-05-30,100,71% of the Earth's surface is covered by water. That's a lot of space to find one fish.,Andrew Stanton
168,8.2,tt0032976,Rebecca,1940,Laurence Olivier,Joan Fontaine,George Sanders,Judith Anderson,Alfred Hitchcock,Drama,Film-Noir,A self-conscious bride is tormented by the memory of her husband's dead first wife.,1940-04-12,130,The shadow of this woman darkened their love.,Daphne Du Maurier
169,8.2,tt0061512,Cool Hand Luke,1967,Paul Newman,George Kennedy,Strother Martin,J.D. Cannon,Stuart Rosenberg,Crime,Drama,A man refuses to conform to life in a rural prison.,1967-11-01,126,"""What we've got here is failure to communicate.""",Donn Pearce
170,8.1,tt0167404,The Sixth Sense,1999,Bruce Willis,Haley Joel Osment,Toni Collette,Olivia Williams,M. Night Shyamalan,Drama,Mystery,A boy who communicates with spirits that don't know they're dead seeks the help of a disheartened child psychologist.,1999-08-06,107,"""I see dead people""",M. Night Shyamalan
171,8.2,tt0084787,The Thing,1982,Kurt Russell,Wilford Brimley,Keith David,Richard Masur,John Carpenter,Horror,Mystery,"It's the first week of winter in 1982. An American Research Base is greeted by an alien force, that can assimilate anything it touches. It's up to the members to stay alive, and be sure of who is human, and who has become one of the Things.",1982-06-25,109,What you fear most... is among you.,Bill Lancaster
172,8.2,tt0892769,How to Train Your Dragon,2010,Jay Baruchel,Gerard Butler,Christopher Mintz-Plasse,Craig Ferguson,Dean DeBlois,Animation,Action,"A hapless young Viking who aspires to hunt dragons becomes the unlikely friend of a young dragon himself, and learns there may be more to the creatures than he assumed.",2010-03-26,98,One adventure will change two worlds,William Davies
173,8.1,tt0477348,No Country for Old Men,2007,Tommy Lee Jones,Javier Bardem,Josh Brolin,Woody Harrelson,Ethan Coen,Crime,Drama,Violence and mayhem ensue after a hunter stumbles upon a drug deal gone wrong and more than two million dollars in cash near the Rio Grande.,2007-11-21,122,There Are No Clean Getaways,Joel Coen
174,8.2,tt2488496,Star Wars: The Force Awakens,2015,Daisy Ridley,John Boyega,Oscar Isaac,Domhnall Gleeson,J.J. Abrams,Action,Adventure,"Three decades after the defeat of the Galactic Empire, a new threat arises. The First Order attempts to rule the galaxy and only a ragtag group of heroes can stop them, along with the help of the Resistance.",2015-12-18,138,Every generation has a story.,Lawrence Kasdan
175,8.2,tt0758758,Into the Wild,2007,Emile Hirsch,Vince Vaughn,Catherine Keener,Marcia Gay Harden,Sean Penn,Adventure,Biography,"After graduating from Emory University, top student and athlete Christopher McCandless abandons his possessions, gives his entire $24,000 savings account to charity and hitchhikes to Alaska to live in the wilderness. Along the way, Christopher encounters a series of characters that shape his life.",2007-10-19,148,Into the heart Into the soul,Sean Penn
176,8.1,tt0266697,Kill Bill: Vol. 1,2003,Uma Thurman,David Carradine,Daryl Hannah,Michael Madsen,Quentin Tarantino,Action,Thriller,The Bride wakens from a four-year coma. The child she carried in her womb is gone. Now she must wreak vengeance on the team of assassins who betrayed her - a team she was once part of.,2003-10-10,111,"In the year 2003, Uma Thurman will kill Bill",Quentin Tarantino
177,8.2,tt0978762,Mary and Max,2009,Toni Collette,Philip Seymour Hoffman,Eric Bana,Barry Humphries,Adam Elliot,Animation,Comedy,"A tale of friendship between two unlikely pen pals: Mary, a lonely, eight-year-old girl living in the suburbs of Melbourne, and Max, a forty-four-year old, severely obese man living in New York.",2009-04-09,92,Two unlikely people. Two different worlds come together in a story about a most unusual friendship.,Adam Elliot
178,8.1,tt2267998,Gone Girl,2014,Ben Affleck,Rosamund Pike,Neil Patrick Harris,Tyler Perry,David Fincher,Crime,Drama,"With his wife's disappearance having become the focus of an intense media circus, a man sees the spotlight turned on him when it's suspected that he may not be innocent.",2014-10-03,149,You don't know what you've got 'til it's...,Gillian Flynn
179,8.1,tt0469494,There Will Be Blood,2007,Daniel Day-Lewis,Paul Dano,Ciarán Hinds,Martin Stringer,Paul Thomas Anderson,Drama,nan,"A story of family, religion, hatred, oil and madness, focusing on a turn-of-the-century prospector in the early days of the business.",2008-01-25,158,There Will Be Greed. There Will Be Vengeance.,Paul Thomas Anderson
180,8.3,tt0091251,Come and See,1985,Aleksey Kravchenko,Olga Mironova,Liubomiras Laucevicius,Vladas Bagdonas,Elem Klimov,Drama,War,"After finding an old rifle, a young boy joins the Soviet resistance movement against ruthless German forces and experiences the horrors of World War II.",1985-10-17,142,,Ales Adamovich
181,8.2,tt0025316,It Happened One Night,1934,Clark Gable,Claudette Colbert,Walter Connolly,Roscoe Karns,Frank Capra,Comedy,Romance,A spoiled heiress running away from her family is helped by a man who is actually a reporter in need of a story.,1934-02-23,105,Two great lovers of the screen in the grandest of romantic comedies !,Robert Riskin
182,8.1,tt0079470,Life of Brian,1979,Graham Chapman,John Cleese,Michael Palin,Terry Gilliam,Terry Jones,Comedy,nan,"Brian is born on the original Christmas, in the stable next door. He spends his life being mistaken for a messiah.",1979-08-17,94,A motion picture destined to offend nearly two thirds of the civilized world. And severely annoy the other third.,Graham Chapman
183,8.1,tt1979320,Rush,2013,Daniel Brühl,Chris Hemsworth,Olivia Wilde,Alexandra Maria Lara,Ron Howard,Action,Biography,The merciless 1970s rivalry between Formula One rivals James Hunt and Niki Lauda.,2013-09-27,123,Everyone's driven by something.,Peter Morgan
184,8.1,tt0395169,Hotel Rwanda,2004,Don Cheadle,Sophie Okonedo,Joaquin Phoenix,Xolani Mali,Terry George,Drama,History,Paul Rusesabagina was a hotel manager who housed over a thousand Tutsi refugees during their struggle against the Hutu militia in Rwanda.,2005-02-04,121,"When a country descended into madness and the world turned its back, one man had to make a choice",Keir Pearson
185,8.1,tt0091763,Platoon,1986,Charlie Sheen,Tom Berenger,Willem Dafoe,Keith David,Oliver Stone,Drama,War,A young recruit in Vietnam faces a moral crisis when confronted with the horrors of war and the duality of man.,1987-02-06,120,The first casualty of war is innocence.,Oliver Stone
186,8.4,tt0074896,The Message,1976,Anthony Quinn,Irene Papas,Michael Ansara,Johnny Sekka,Moustapha Akkad,Adventure,Biography,"In the 7th century, Mohammed is visited by Angel Gabriel who urges him to lead the people of Mecca and worship God...",1977-07-08,177,"In four decades only four... ""The Robe"" ""The Ten Commandments"" ""Ben-Hur"" and now... For the first time...the vast, spectacular drama that changed the world!",H.A.L. Craig
187,8.2,tt0050783,The Nights of Cabiria,1957,Giulietta Masina,François Périer,Franca Marzi,Dorian Gray,Federico Fellini,Drama,nan,A waifish prostitute wanders the streets of Rome looking for true love but finds only heartbreak.,1957-09-13,117,The story of a betrayed but unquenchable little Roman street-walker.,Maria Molinari
188,8.1,tt0074958,Network,1976,Faye Dunaway,William Holden,Peter Finch,Robert Duvall,Sidney Lumet,Drama,nan,A television network cynically exploits a deranged former anchor's ravings and revelations about the news media for its own profit.,1976-11-27,121,"""NETWORK""... the humanoids, the love story, the trials and tribulations, the savior of television, the attempted suicides, the assassination -- it's ALL coming along with a galaxy of stars you know and love!",Paddy Chayefsky
189,8.1,tt1130884,Shutter Island,2010,Leonardo DiCaprio,Emily Mortimer,Mark Ruffalo,Ben Kingsley,Martin Scorsese,Mystery,Thriller,"In 1954, a U.S. marshal investigates the disappearance of a murderess who escaped from a hospital for the criminally insane.",2010-02-19,138,Someone is missing.,Laeta Kalogridis
190,8.2,tt0046268,The Wages of Fear,1953,Yves Montand,Charles Vanel,Peter van Eyck,Folco Lulli,Henri-Georges Clouzot,Adventure,Drama,"In a decrepit South American village, four men are hired to transport an urgent nitroglycerine shipment without the equipment that would make it safe.",1955-02-16,131,The complete restored version of the 1953 French classic [reissue],Georges Arnaud
191,8.1,tt1895587,Spotlight,2015,Mark Ruffalo,Michael Keaton,Rachel McAdams,Liev Schreiber,Tom McCarthy,Biography,Crime,"The true story of how the Boston Globe uncovered the massive scandal of child molestation and cover-up within the local Catholic Archdiocese, shaking the entire Catholic Church to its core.",2015-11-20,128,Break the story. Break the silence.,Josh Singer
192,8.1,tt0033870,The Maltese Falcon,1941,Humphrey Bogart,Mary Astor,Gladys George,Peter Lorre,John Huston,Film-Noir,Mystery,"A private detective takes on a case that involves him with three eccentric criminals, a gorgeous liar, and their quest for a priceless statuette.",1941-10-18,100,It's thrilling . . . it's chilling . . . it's the most baffling mystery story in years !,John Huston
193,8.1,tt0107207,In the Name of the Father,1993,Daniel Day-Lewis,Pete Postlethwaite,Alison Crosbie,Philip King,Jim Sheridan,Biography,Drama,A man's coerced confession to an IRA bombing he did not commit results in the imprisonment of his father as well. An English lawyer fights to free them.,1994-02-25,133,Falsely accused.  Wrongly imprisoned.  He fought for justice to clear his father's name.,Gerry Conlon
194,8.1,tt0064115,Butch Cassidy and the Sundance Kid,1969,Paul Newman,Robert Redford,Katharine Ross,Strother Martin,George Roy Hill,Biography,Crime,Two Western bank/train robbers flee to Bolivia when the law gets too close.,1969-10-24,110,Just for the fun of it!,William Goldman
195,8.1,tt0092005,Stand by Me,1986,Wil Wheaton,River Phoenix,Corey Feldman,Jerry O'Connell,Rob Reiner,Adventure,Drama,"After the death of a friend, a writer recounts a boyhood journey to find the body of a missing boy.",1986-08-22,89,"For some, it's the last real taste of innocence, and the first real taste of life. But for everyone, it's the time that memories are made of.",Stephen King
196,8.1,tt1392190,Mad Max: Fury Road,2015,Tom Hardy,Charlize Theron,Nicholas Hoult,Zoë Kravitz,George Miller,Action,Adventure,"A woman rebels against a tyrannical ruler in postapocalyptic Australia in search for her home-land with the help of a group of female prisoners, a psychotic worshipper, and a drifter named Max.",2015-05-15,120,WHAT A LOVELY DAY (all caps One Sheet),George Miller
197,8.1,tt0053198,The 400 Blows,1959,Jean-Pierre Léaud,Albert Rémy,Claire Maurier,Guy Decomble,François Truffaut,Crime,Drama,"Moving story of a young boy who, left without attention, delves into a life of petty crime.",1959-11-16,99,From the Vanguard of New Film-Makers Comes an Extraordinary Motion Picture,François Truffaut
198,8.1,tt3011894,Wild Tales,2014,Darío Grandinetti,María Marull,Mónica Villa,Rita Cortese,Damián Szifrón,Comedy,Drama,Six short stories that explore the extremities of human behavior involving people in distress.,2014-08-21,122,We can all lose control,Damián Szifrón
199,8.1,tt2024544,12 Years a Slave,2013,Chiwetel Ejiofor,Michael Kenneth Williams,Michael Fassbender,Brad Pitt,Steve McQueen,Biography,Drama,"In the antebellum United States, Solomon Northup, a free black man from upstate New York, is abducted and sold into slavery.",2013-11-08,134,The extraordinary true story of Solomon Northup,John Ridley
200,8.1,tt0060827,Persona,1966,Bibi Andersson,Liv Ullmann,Margaretha Krook,Gunnar Björnstrand,Ingmar Bergman,Drama,Thriller,A nurse is put in charge of a mute actress and finds that their personas are melding together.,1967-03-16,83,A new film by Ingmar Bergman,Ingmar Bergman
201,8.1,tt0052618,Ben-Hur,1959,Charlton Heston,Jack Hawkins,Stephen Boyd,Haya Harareet,William Wyler,Adventure,Drama,"When a Jewish prince is betrayed and sent into slavery by a Roman friend, he regains his freedom and comes back for revenge.",1960-01-29,212,A Tale of the Christ,Lew Wallace
202,8.1,tt2278388,The Grand Budapest Hotel,2014,Ralph Fiennes,F. Murray Abraham,Mathieu Amalric,Adrien Brody,Wes Anderson,Adventure,Comedy,"The adventures of Gustave H, a legendary concierge at a famous hotel from the fictional Republic of Zubrowka between the first and second World Wars, and Zero Moustafa, the lobby boy who becomes his most trusted friend.",2014-03-28,99,,Stefan Zweig
203,8.1,tt0405159,Million Dollar Baby,2004,Hilary Swank,Clint Eastwood,Morgan Freeman,Jay Baruchel,Clint Eastwood,Drama,Sport,A determined woman works with a hardened boxing trainer to become a professional.,2005-01-28,132,"Beyond his silence, there is a past. Beyond her dreams, there is a feeling. Beyond hope, there is a memory. Beyond their journey, there is a love.",Paul Haggis
204,8.1,tt0245712,Amores Perros,2000,Emilio Echevarría,Gael García Bernal,Goya Toledo,Álvaro Guerrero,Alejandro G. Iñárritu,Drama,Thriller,"A horrific car accident connects three stories, each involving characters dealing with loss, regret, and life's harsh realities, all in the name of love.",2001-04-13,154,Love. Betrayal. Death.,Guillermo Arriaga
205,8.1,tt0093779,The Princess Bride,1987,Cary Elwes,Mandy Patinkin,Robin Wright,Chris Sarandon,Rob Reiner,Adventure,Family,"While home sick in bed, a young boy's grandfather reads him a story called The Princess Bride.",1987-10-09,98,The story of a man and a woman who lived happily ever after. Even though the courtship almost killed them.,William Goldman
206,8.1,tt0107290,Jurassic Park,1993,Sam Neill,Laura Dern,Jeff Goldblum,Richard Attenborough,Steven Spielberg,Adventure,Sci-Fi,"During a preview tour, a theme park suffers a major power breakdown that allows its cloned dinosaur exhibits to run amok.",1993-06-11,127,Life finds a way.,Michael Crichton
207,8.1,tt1028532,Hachi: A Dog's Tale,2009,Richard Gere,Joan Allen,Cary-Hiroyuki Tagawa,Sarah Roemer,Lasse Hallström,Drama,Family,A college professor's bond with the abandoned dog he takes into his home.,2009-08-08,93,"A true story of faith, devotion and undying love.",Stephen P. Lindsey
208,8.1,tt0087544,Nausicaä of the Valley of the Wind,1984,Sumi Shimamoto,Mahito Tsujimura,Hisako Kyôda,Gorô Naya,Hayao Miyazaki,Animation,Adventure,Warrior/pacifist Princess Nausicaä desperately struggles to prevent two warring nations from destroying themselves and their dying planet.,1984-03-11,95,Miyazaki's epic masterpiece (2005 Disney release),Hayao Miyazaki
209,8.1,tt0052311,Touch of Evil,1958,Charlton Heston,Orson Welles,Janet Leigh,Joseph Calleia,Orson Welles,Crime,Drama,"A stark, perverse story of murder, kidnapping, and police corruption in a Mexican border town.",1958-05-21,108,The Overwhelming Drama of a Strange Vengeance,Orson Welles
210,8.1,tt0079944,Stalker,1979,Alisa Freyndlikh,Aleksandr Kaydanovskiy,Anatoliy Solonitsyn,Nikolay Grinko,Andrei Tarkovsky,Drama,Sci-Fi,A guide leads two men through an area known as the Zone to find a room that grants wishes.,1980-04-17,163,,Arkadiy Strugatskiy
211,8.1,tt0353969,Memories of Murder,2003,Kang-ho Song,Sang-kyung Kim,Roe-ha Kim,Jae-ho Song,Joon-ho Bong,Crime,Drama,"In 1986, in the province of Gyunggi, in South Korea, a second young and beautiful woman is found dead...",2003-05-02,132,,Joon-ho Bong
212,8.1,tt0032551,The Grapes of Wrath,1940,Henry Fonda,Jane Darwell,John Carradine,Charley Grapewin,John Ford,Drama,History,"A poor Midwest family is forced off of their land. They travel to California, suffering the misfortunes of the homeless in the Great Depression.",1940-03-15,129,The thousands who have read the book will know why WE WILL NOT SELL ANY CHILDREN TICKETS to see this picture!,Nunnally Johnson
213,8.1,tt0120382,The Truman Show,1998,Jim Carrey,Ed Harris,Laura Linney,Noah Emmerich,Peter Weir,Comedy,Drama,An insurance salesman/adjuster discovers his entire life is actually a television show.,1998-06-05,103,All the world's a stage...,Andrew Niccol
214,8.1,tt0075686,Annie Hall,1977,Woody Allen,Diane Keaton,Tony Roberts,Carol Kane,Woody Allen,Comedy,Romance,Neurotic New York comedian Alvy Singer falls in love with the ditzy Annie Hall.,1977-04-20,93,A nervous romance.,Woody Allen
215,8.1,tt0112471,Before Sunrise,1995,Ethan Hawke,Julie Delpy,Andrea Eckert,Hanno Pöschl,Richard Linklater,Drama,Romance,"A young man and woman meet on a train in Europe, and wind up spending one evening together in Vienna. Unfortunately, both know that this will probably be their only night together.",1995-01-27,105,Jump on and live a Eurorail journey you will never forget!,Richard Linklater
216,8.1,tt2948356,Zootopia,2016,Ginnifer Goodwin,Jason Bateman,Idris Elba,Jenny Slate,Byron Howard,Animation,Adventure,"In a city of anthropomorphic animals, a rookie bunny cop and a cynical con artist fox must work together to uncover a conspiracy.",2016-03-04,108,Welcome to the urban jungle.,Byron Howard
